"Analysing the driving load on electric vehicles using unsupervised segmentation models as enabler to determine the time of battery replacement and assess driving mileage","T. T. Nguyen; A. Mrowca; B. Moser; A. Jossen","BMW Group, Petuelring 130, 80788 München, Germany; BMW Group, Petuelring 130, 80788 München, Germany; BMW Group, Petuelring 130, 80788 München, Germany; Institute for Electrical Energy Storage Technology, Technische Universität München, Arcisstraße 21, 80333 München, Germany","2018 Thirteenth International Conference on Ecological Vehicles and Renewable Energies (EVER)","","2018","","","1","7","The aim of this contribution is to study the driving load on electric vehicles through data mining methods. The battery pack is currently the major cost driver for these vehicles. Thus, battery durability is an important lever to economically establish electric mobility in the mass market. A segmentation modelling approach, based on unsupervised clustering algorithms, evaluates battery management system field data from BMW i3 vehicles such as state of charge, temperature and current in terms of their historical distribution. Clustering algorithms, due to their frequent use in the field of machine learning and information retrieval, are able to analyse big quantities of vehicle data with the aim to group vehicles with similar driving behaviour. The cluster analysis is further validated using the method of calculating respective silhouette coefficients to assess clustering performance and the influence of input parameters. The analysis of histograms concludes with the definition of the most common types of drivers worldwide. The vehicle clusters can further be correlated with battery ageing in order to find suitable 2nd life applications as part of stationary energy storage systems.","","978-1-5386-5966-3978-1-5386-5965-6978-1-5386-5967","10.1109/EVER.2018.8362381","","https://ieeexplore.ieee.org/stamp/stamp.jsp?arnumber=8362381","automotive battery;lithium-ion batteries;electrical energy storage;unsupervised segmentation model;clustering;silhouette coefficient","Batteries;Histograms;Clustering algorithms;Data mining;State of charge;Temperature distribution;Temperature sensors","battery management systems;battery powered vehicles;data mining;driver information systems;energy storage;learning (artificial intelligence);pattern clustering;road vehicles;secondary cells","electric vehicles;unsupervised segmentation models;data mining methods;battery pack;battery durability;electric mobility;segmentation modelling approach;unsupervised clustering algorithms;battery management system field data;cluster analysis;clustering performance;vehicle clusters;battery ageing;driving behaviour;driving load analysis;battery time replacement;driving mileage assessment","","","","24","","","","","IEEE","IEEE Conferences"
"Modeling and simulation of a wave energy converter system. Case study: Point absorber","J. S. Artal-Sevil; J. A. Domínguez; H. El-Shalakany; R. Dufo","Department of Electrical Engineering. University School of Engineering and Architecture. University of Zaragoza. Campus Río Ebro. María de Luna 3. Edificio Torres Quevedo, 50018. Zaragoza (Spain); Department of Electrical Engineering. University School of Engineering and Architecture. University of Zaragoza. Campus Río Ebro. María de Luna 3. Edificio Torres Quevedo, 50018. Zaragoza (Spain); Department of Electrical Engineering. University School of Engineering and Architecture. University of Zaragoza. Campus Río Ebro. María de Luna 3. Edificio Torres Quevedo, 50018. Zaragoza (Spain); Department of Electrical Engineering. University School of Engineering and Architecture. University of Zaragoza. Campus Río Ebro. María de Luna 3. Edificio Torres Quevedo, 50018. Zaragoza (Spain)","2018 Thirteenth International Conference on Ecological Vehicles and Renewable Energies (EVER)","","2018","","","1","7","Wind and solar energy have been taking the control of the renewable energy market, as costs have decreased rapidly and the threats from climate change have made clear the need to change from fossil fuels. Wave energy has been underrated all the past years. Wave energy has more potential and more advantage the other forms of renewable energy. More predictable, consistent and controllable than either wind or solar power, with the right infrastructure in place, it could be a sustainable alternative for supplying base-load power. It also has a very low impact that neither disturbs aquatic life nor spoils the coastal view that prompts so much ire from the public. The paper presents a wave power converter system. The results obtained are analyzed and the data of the simulation are presented as preliminary validation. The purpose it is to discuss different wave energy converter WEC, we will have a full simulation of each type and discuss the functioning of each one of them. The models are implemented and simulated through the applications Design Modeler, ANSYS AQWA and WEC-SIM. On the basis of the simulated results, we can conclude that generating power from the wave is quite promising for our future and will be a great addition in the renewable energy market, and will contribute to face the global climate change problem.","","978-1-5386-5966-3978-1-5386-5965-6978-1-5386-5967","10.1109/EVER.2018.8362405","","https://ieeexplore.ieee.org/stamp/stamp.jsp?arnumber=8362405","Wave Energy Converter WEC;Point Absorber PTO;wave energy;buoy;ocean current power;sustainability","Computational modeling;Renewable energy sources;Prototypes;Biological system modeling;Finite element analysis;Oceans;Data models","power markets;power system simulation;wave power plants","applications Design Modeler;renewable energy market;global climate change problem;wave energy converter system;Point absorber;base-load power;wave power converter system;ANSYS AQWA;WEC-SIM","","","","24","","","","","IEEE","IEEE Conferences"
"B6-VSI emulation-based DTC strategy dedicated to B3-VSI fed induction motor drives","I. N. E. Badsi; B. E. Badsi; A. Masmoudi","Research Laboratory of Renewable Energies and Electric Vehicles (RELEV), University of Sfax, Sfax Engineering National School (ENIS), P.O. Box 1173, 3038 Sfax, Tunisia; Research Laboratory of Renewable Energies and Electric Vehicles (RELEV), University of Sfax, Sfax Engineering National School (ENIS), P.O. Box 1173, 3038 Sfax, Tunisia; Research Laboratory of Renewable Energies and Electric Vehicles (RELEV), University of Sfax, Sfax Engineering National School (ENIS), P.O. Box 1173, 3038 Sfax, Tunisia","2018 Thirteenth International Conference on Ecological Vehicles and Renewable Energies (EVER)","","2018","","","1","9","The paper proposes a novel direct torque control (DTC) strategy for induction motor (IM) drives fed by (B3-VSI). The introduced strategy, noted DTC<sub>B3</sub><sup>Emul</sup>, is based on the emulation of the operation of the conventional inverter (B6-VSI). This has been achieved thanks to a suitable combinations of the three voltage vectors intrinsically generated by the B3-VSI, leading to the synthesis of the six balanced voltage vectors of the B3-VSI. This approach has been adopted in the design of the look-up table of the proposed DTC strategy which considers a subdivision of the Concordia plan into six sectors. Simulation and experimental results have revealed that, thanks to the proposed DTC strategy, B3-VSI fed IM drives exhibit interesting performance. These have been experimentally validated.","","978-1-5386-5966-3978-1-5386-5965-6978-1-5386-5967","10.1109/EVER.2018.8362371","","https://ieeexplore.ieee.org/stamp/stamp.jsp?arnumber=8362371","Direct torque control;induction motor drive;conventional inverter;reduced structure inverter;emulation;look-up table","Stators;Inverters;Torque;Table lookup;Hysteresis;Control systems;Electromagnetics","induction motor drives;invertors;machine vector control;table lookup;torque control","direct torque control strategy;noted DTC;look-up table;balanced voltage vectors;voltage vectors;B3-VSI fed IM drives;induction motor drives;B6-VSI emulation-based DTC strategy","","","","22","","","","","IEEE","IEEE Conferences"
"Performance analysis of an advanced bus-clamping DTC strategy for IM drives","B. Bouzidi; R. Mars; B. E. Badsi","Research Laboratory of Renewable Energies and Electric Vehicles (RELEV), University of Sfax, Sfax Engineering National School (ENIS), P.O. Box 1173, 3038 Sfax, Tunisia; Research Laboratory of Renewable Energies and Electric Vehicles (RELEV), University of Sfax, Sfax Engineering National School (ENIS), P.O. Box 1173, 3038 Sfax, Tunisia; Research Laboratory of Renewable Energies and Electric Vehicles (RELEV), University of Sfax, Sfax Engineering National School (ENIS), P.O. Box 1173, 3038 Sfax, Tunisia","2018 Thirteenth International Conference on Ecological Vehicles and Renewable Energies (EVER)","","2018","","","1","9","This paper proposes a novel Bus-Clamping DTC strategy (BC-DTC strategy) dedicated to two-level three-phase inverter fed induction motor (IM) drives. This strategy consists in the synthesis of the vector selection table, suitably arranged considering the 60-Degree (60°) bus-clamping technique. Different from other 60-Degree Bus-Clamping based DTC (60<sup>°</sup>BC-DTC) strategies, the approach adopted in the selection of the clamped phase of the proposed strategy depends on the revolving reference stator current vector I<sub>s</sub>instead of the stator flux vector Φ<sub>s</sub>. A comparison study between the classical DTC strategy and the proposed BC-DTC one is achieved. Simulation results have proven that the proposed BC-DTC strategy exhibits better performance during both transient and steady-state operations than the first one. Therefore, a reduction of the electromagnetic torque ripple amplitudes is gained. Extending the comparison to the converter operation, and through various comparison criteria, we have found that the considered 60<sup>°</sup>BC-DTC strategy offers the lowest average commutation frequency and the lowest average switching losses and the highest quality factor.","","978-1-5386-5966-3978-1-5386-5965-6978-1-5386-5967","10.1109/EVER.2018.8362376","","https://ieeexplore.ieee.org/stamp/stamp.jsp?arnumber=8362376","60° BC-DTC strategy;induction motor;two-level three-phase inverter;revolving reference stator current vector;comparison study;comparison criteria","Stators;Induction motors;Torque;Inverters;Voltage control;Switches;Electromagnetics","induction motor drives;invertors;stators;torque","BC-DTC strategy;clamped phase;BC-DTC one;advanced bus-clamping DTC strategy","","","","11","","","","","IEEE","IEEE Conferences"
"Comparison of market operation strategies for photovoltaic power plants with storage systems providing frequency ancillary services","A. González-Garrido; A. Saez-de-Ibarra; H. Gaztañaga; A. Milo; P. Eguia","IK4-Ikerlan Technology Research Centre, Energy Storage and Management Area, P° J. M. Arizmendiarrieta 2, 20500 Arrasate-Mondragón, Spain; IK4-Ikerlan Technology Research Centre, Energy Storage and Management Area, P° J. M. Arizmendiarrieta 2, 20500 Arrasate-Mondragón, Spain; IK4-Ikerlan Technology Research Centre, Energy Storage and Management Area, P° J. M. Arizmendiarrieta 2, 20500 Arrasate-Mondragón, Spain; IK4-Ikerlan Technology Research Centre, Energy Storage and Management Area, P° J. M. Arizmendiarrieta 2, 20500 Arrasate-Mondragón, Spain; University of the Basque Country, Electrical Engineering Department, Alda. Urquijo s/n, 48013 Bilbao, Spain","2018 Thirteenth International Conference on Ecological Vehicles and Renewable Energies (EVER)","","2018","","","1","8","This paper proposes an energy storage management with an advanced and optimized market participation methodology for Day-Ahead Market (DM), Intraday Market (IM) and Secondary Reserve Market (SRM), with the aim of defining the optimal trade-off between the profits and the fulfilment of SRM requirements. This paper aims to demonstrate their potential to participate not only in energy markets, but also in frequency ancillary services in order to contribute to the grid stability, as well as being an additional source of revenues. The suitable market strategy must ensure an optimal and reliable operation despite the uncertainty of solar generation, the uncertain real-time CRR signal and the limited capacity of the energy storage system.","","978-1-5386-5966-3978-1-5386-5965-6978-1-5386-5967","10.1109/EVER.2018.8362386","","https://ieeexplore.ieee.org/stamp/stamp.jsp?arnumber=8362386","Ancillary Services;Day-Ahead Electricity Market;Energy Management;Energy Storage System;Intraday Markets;Market Operation;Secondary Reserve Market;Solar Generation","Real-time systems;Optimization;Power generation;State of charge;Economics;Energy storage;Electricity supply industry","energy storage;photovoltaic power systems;power generation economics;power markets","market operation strategies;photovoltaic power plants;storage systems;frequency ancillary services;energy storage management;advanced market participation methodology;optimized market participation methodology;Day-Ahead Market;Intraday Market;Secondary Reserve Market;energy markets;suitable market strategy;energy storage system","","","","22","","","","","IEEE","IEEE Conferences"
"An ergonomics and safety study of the aCar electric vehicle design optimization","M. Šoltés; F. Degmayr; L. Berger; S. Koberstaedt; M. Lienkamp","Institute of Automotive Technology, Technical University of Munich, Boltzmannstrasse 15, 85748 Garching, Germany; Institute of Automotive Technology, Technical University of Munich, Boltzmannstrasse 15, 85748 Garching, Germany; Institute of Automotive Technology, Technical University of Munich, Boltzmannstrasse 15, 85748 Garching, Germany; Institute of Automotive Technology, Technical University of Munich, Boltzmannstrasse 15, 85748 Garching, Germany; Institute of Automotive Technology, Technical University of Munich, Boltzmannstrasse 15, 85748 Garching, Germany","2018 Thirteenth International Conference on Ecological Vehicles and Renewable Energies (EVER)","","2018","","","1","8","For specialized electric vehicles outside of the typical vehicle classes, the traditional methods for designing the ergonomics do not provide adequate results. An ergonomics study and new methods described in this paper are required.","","978-1-5386-5966-3978-1-5386-5965-6978-1-5386-5967","10.1109/EVER.2018.8362407","","https://ieeexplore.ieee.org/stamp/stamp.jsp?arnumber=8362407","ergonomics;ergonomics study;electric vehicles;vehicle safety;offroad vehicle","Wheels;Ergonomics;Prototypes;Sociology;Statistics;Roads;Vehicles","automobiles;design engineering;electric vehicles;ergonomics;road safety","safety study;aCar electric vehicle design optimization;specialized electric vehicles;ergonomics study;vehicle classes;ergonomics design","","","","14","","","","","IEEE","IEEE Conferences"
"A bidirectional dual active bridge converter for V2G applications based on DC microgrid","I. Skouros; A. Bampoulas; A. Karlis","Democritus University of Thrace, Department of Electrical and Computer Engineering, Xanthi, Greece; Democritus University of Thrace, Department of Electrical and Computer Engineering, Xanthi, Greece; Democritus University of Thrace, Department of Electrical and Computer Engineering, Xanthi, Greece","2018 Thirteenth International Conference on Ecological Vehicles and Renewable Energies (EVER)","","2018","","","1","9","DC microgrids are becoming more and more popular since they are considered the next generation power systems. In the meantime, Electric Vehicles (EVs) have gained increased popularity because they can be a promising solution to the rising concerns about environmental and energy issues. Due to the attractiveness of the Vehicle to Grid (V2G) technology, the present study focuses on designing a bidirectional DC charger of an EV. The DC-DC converter used in this study is the Dual Active Bridge converter. A design methodology as well as a control strategy is proposed. The proposed charging configuration has been simulated in Matlab/Simulink. Some interesting results about the effectiveness and the dynamic response of the proposed configuration have been obtained.","","978-1-5386-5966-3978-1-5386-5965-6978-1-5386-5967","10.1109/EVER.2018.8362396","","https://ieeexplore.ieee.org/stamp/stamp.jsp?arnumber=8362396","electric vehicle;dc micogrids;dual active bridge converter;lithium ion battery model;vehicle to grid technology","Batteries;Inductors;Vehicle-to-grid;Zero voltage switching;Microgrids;DC-DC power converters;Bridge circuits","battery powered vehicles;DC-DC power convertors;distributed power generation;electric vehicles;vehicle-to-grid","DC microgrid;Electric Vehicles;environmental energy issues;bidirectional DC charger;DC-DC converter;bidirectional dual active bridge converter;next generation power systems;V2G applications;Vehicle to Grid technology;Matlab-Simulink","","1","","19","","","","","IEEE","IEEE Conferences"
"Method to optimize NVH-behaviour of a brushless electrically excited synchronous machine","H. Spielmann; H. E. Friedrich","Institute of Vehicle Concepts - German Aerospace Center (DLR), Pfaffenwaldring 38-40; 70569 Stuttgart, Germany; Institute of Vehicle Concepts - German Aerospace Center (DLR), Pfaffenwaldring 38-40; 70569 Stuttgart, Germany","2018 Thirteenth International Conference on Ecological Vehicles and Renewable Energies (EVER)","","2018","","","1","8","As part of the ongoing NGC-project (Next Generation Car) related to the research of new technologies for future road vehicles at the DLR, this paper is dedicated to the substitution of an optimization method of a brushless electrically excited synchronous machine for use in electrical vehicles. In this application high torque densities and small vibrations are needed, so an optimization of torque and torque ripple is done. As optimization parameters torque ripple reduction techniques as skewing, cosine formed tooth and width of tooth are chosen. The combined multi-parameter optimization is necessary because of interactions between the optimization parameter effects. An analysis for a machine of 25 kW, used in urban electric vehicles, is done with different excitations to build up the working points. The results show a large effect of increasing skewing to decrease torque and increase ripples independent of excitation. The effects of the other techniques are smaller. The cosine form has in the example optimization a strong dependency on excitation.","","978-1-5386-5966-3978-1-5386-5965-6978-1-5386-5967","10.1109/EVER.2018.8362357","","https://ieeexplore.ieee.org/stamp/stamp.jsp?arnumber=8362357","electrically excited synchronous machine;torque ripple;skewing;cosine formed tooth;tooth width;brushless energy transmission","Torque;Optimization;Rotors;Stators;Torque measurement;Air gaps;Saturation magnetization","brushless machines;electric vehicles;machine control;road vehicles;synchronous machines","brushless electrically excited synchronous machine;future road vehicles;electrical vehicles;combined multiparameter optimization;optimization parameter effects;urban electric vehicles;torque ripple reduction techniques;NVH-behaviour;Next Generation Car;high torque densities;torque ripple;power 25.0 kW","","","","11","","","","","IEEE","IEEE Conferences"
"Three traction motors with different magnet materials — Influence on cost, losses, vehicle performance, energy use and environmental impact","E. A. Grunditz; S. T. Lundmark; M. Alatalo; T. Thiringer; A. Nordelöf","Division of Electric Power Engineering, Chalmers University of Technology, SE-412 96 Göteborg, Sweden; Division of Electric Power Engineering, Chalmers University of Technology, SE-412 96 Göteborg, Sweden; Division of Electric Power Engineering, Chalmers University of Technology, SE-412 96 Göteborg, Sweden; Division of Electric Power Engineering, Chalmers University of Technology, SE-412 96 Göteborg, Sweden; Division of Environmental Systems Analysis, Chalmers University of Technology, SE-412 96 Göteborg, Sweden","2018 Thirteenth International Conference on Ecological Vehicles and Renewable Energies (EVER)","","2018","","","1","13","The aim of reducing both cost and environmental impact of automotive electric traction motors motivates the examination of motor performance when using magnets of varying strength and materials. Such investigations have attracted increasing interest in recent years. Given the same take-off torque capability, three motors are compared that have the same stator geometry but different magnet materials in the rotor; two PMSMs - one with Nd(Dy)FeB and one with SmCo magnets - and one PMaSynRM with strontium-ferrite magnets. To compensate the weaker magnets, their corresponding core stacks are prolonged. The resulting torque capability at high speed levels is lower for the SmCo PMSM and ferrite PMaSynRM compared to the Nd(Dy)FeB PMSM. The ferrite PMaSynRM has the poorest dynamic vehicle performance, but also the lowest energy losses over a wide range of drive cycles. In addition, the ferrite based motor option has the lowest environmental impact during manufacturing as well as the lowest material cost estimate. The SmCo motor has slightly lower losses than the Nd(Dy)FeB, but the highest material cost. Certainly, the result signals that further in-depth studies of the described PMaSynRM are of high relevance.","","978-1-5386-5966-3978-1-5386-5965-6978-1-5386-5967","10.1109/EVER.2018.8362387","","https://ieeexplore.ieee.org/stamp/stamp.jsp?arnumber=8362387","electric machine;permanent magnet machines;magnet;magnetic materials;NdFeB;SmCo;Ferrite;FEM simulation;electrical vehicle;hybrid electrical vehicle;losses;energy consumption;efficiency;cost estimation;life cycle assessment","Ferrites;Traction motors;Magnetic cores;Permanent magnet motors;Torque;Rotors;Magnetic flux","automotive electrics;boron alloys;cobalt alloys;dysprosium alloys;ferrites;iron alloys;neodymium alloys;permanent magnet motors;samarium alloys;stators;traction motors","automotive electric traction motors;SmCo magnets;strontium-ferrite magnets;SmCo PMSM;ferrite PMaSynRM;poorest dynamic vehicle performance;ferrite based motor option;SmCo motor;magnet materials;environmental impact;material cost estimate;stator geometry;NdDyFeB PMSM;SmCo;NdDyFeB;SrFe3O4","","","","42","","","","","IEEE","IEEE Conferences"
"Analysis and design of bi-directional DC-DC converters for ultracapacitors management in EVs","F. Pellitteri; V. Castiglia; P. Livreri; R. Miceli","Department of Energy, Information and Mathematical models, University of Palermo, Palermo, Italy; Department of Energy, Information and Mathematical models, University of Palermo, Palermo, Italy; Department of Energy, Information and Mathematical models, University of Palermo, Palermo, Italy; Department of Energy, Information and Mathematical models, University of Palermo, Palermo, Italy","2018 Thirteenth International Conference on Ecological Vehicles and Renewable Energies (EVER)","","2018","","","1","6","The on-board energy-storage system of an electric vehicle (EV) should be able to collect large amounts of energy and to deal with fast load variations. The use of hybrid power sources as storage devices is an attractive solution, aiming at maximizing both energy and power density. The battery/ultracapacitors (UCs) combination promises to provide significant benefits. An accurate design of bi-directional converters, capable of proplery managing the charge/discharge of the UCs from/to a voltage bus, is essential. In this paper, a bi-directional DC-DC converter connected to a bank of UCs is described and the simulation results are given as well. The designed converter is a buck-boost type, able to manage a 40kW peak power for a duration of 3s, required by a 48 V bus-connected load.","","978-1-5386-5966-3978-1-5386-5965-6978-1-5386-5967","10.1109/EVER.2018.8362349","","https://ieeexplore.ieee.org/stamp/stamp.jsp?arnumber=8362349","DC-DC converter;Ultracapacitors;Electric Vehicle;Energy Management;Battery","Supercapacitors;DC-DC power converters;Batteries;Bidirectional control;Topology;Resistance","DC-DC power convertors;electric vehicles;supercapacitors","bi-directional DC-DC converter;ultracapacitors management;on-board energy-storage system;hybrid power sources;storage devices;power density;bi-directional converters;power 40.0 kW;time 3.0 s;voltage 48.0 V","","","","33","","","","","IEEE","IEEE Conferences"
