"Thermal management concepts for vehicles of next generation","M. Schier; N. Kevlishvili; B. Mayer","Institute of Vehicle Concepts, German Aerospace Center, Pfaffenwaldring 38-40, D-70569 Stuttgart, Germany; Institute of Vehicle Concepts, German Aerospace Center, Pfaffenwaldring 38-40, D-70569 Stuttgart, Germany; Institute of Vehicle Concepts, German Aerospace Center, Pfaffenwaldring 38-40, D-70569 Stuttgart, Germany","2014 Ninth International Conference on Ecological Vehicles and Renewable Energies (EVER)","","2014","","","1","7","The present paper is a review of the selected research activities at the German Aerospace Center on the field of terrestrial vehicles thermal management. The methods and some results of the passenger cabin measurements and human comfort studies are described. Several shortly depicted concepts for the cabin air-conditioning present the challenges of current and future research topics. Some examples of newly developed highly integrated components and the component tempering strategies for next generation vehicles are given.","","978-1-4799-3787-5978-1-4799-3786","10.1109/EVER.2014.6844116","","https://ieeexplore.ieee.org/stamp/stamp.jsp?arnumber=6844116","next generation car;thermal management;active expansion;magnetocaloric refrigeration;fuel cells;thermochemical storage;thermoelectric generator","Heating;Batteries;Vehicles;Magnetic field measurement;Thermal management;Valves","air conditioning;automobiles;thermal management (packaging);thermoelectric conversion","thermal management concepts;next generation vehicles;German Aerospace Center;terrestrial vehicles thermal management;passenger cabin measurements;human comfort studies;air-conditioning","","4","","10","","","","","IEEE","IEEE Conferences"
"Interactive virtual experiments for web-based education on wind energy","F. Einwächter; P. Tourou; C. Sourkounis","Institute of Power Systems Technology and Power Mechatronics, Ruhr-University Bochum, Universitätsstr. 150, 44801, Germany; Institute of Power Systems Technology and Power Mechatronics, Ruhr-University Bochum, Universitätsstr. 150, 44801, Germany; Institute of Power Systems Technology and Power Mechatronics, Ruhr-University Bochum, Universitätsstr. 150, 44801, Germany","2014 Ninth International Conference on Ecological Vehicles and Renewable Energies (EVER)","","2014","","","1","7","The ongoing energy transition from conventional to renewable energy sources increases the demand for qualified personnel in the field of alternative power generation. Especially wind energy plays an increasingly important role in today's power industry as more electricity is generated by wind on a global scale. The complex and multidisciplinary nature of wind energy conversion systems (WECS) makes the understanding of this topic a challenging task. In this paper current e-learning trends, like virtual and remote experiments in electrical engineering education are discussed. A novel Web-based learning module on wind energy conversion and control that utilizes easy-to-use interactive virtual experiments is introduced. The last two chapters of this module deal with the operating principles of a three-phase voltage source converter (VSC) and with the control of a DFIG-based wind energy conversion system. For both chapters a virtual experiment has been developed that helps the learner to get a deeper understanding of the presented theory. In both cases the educational approach and the learning objectives are explained, as well as the graphical user interface of the experiment, its operation and interaction possibilities.","","978-1-4799-3787-5978-1-4799-3786","10.1109/EVER.2014.6844000","","https://ieeexplore.ieee.org/stamp/stamp.jsp?arnumber=6844000","Teaching;Education tool;Wind energy;Education methodology;Renewable energy systems","Wind energy;Vectors;Switches;Power conversion;Rotors;Education","asynchronous generators;computer aided instruction;graphical user interfaces;interactive systems;Internet;power engineering computing;power engineering education;wind power plants","interactive virtual experiments;Web-based education;e-learning trends;remote experiments;Web-based learning module;WECS;electrical engineering education;three-phase voltage source converter;VSC;DFIG-based wind energy conversion system;graphical user interface","","","","19","","","","","IEEE","IEEE Conferences"
"A simple and accurate model of photovoltaic modules for power system design","V. Boscaino; G. Cipriani; V. Di Dio; R. Miceli; G. Capponi","Department of Energy, Information engineering and Mathematical models (DEIM), University of Palermo, viale delle scienze - building 9, 90128, Italy; Department of Energy, Information engineering and Mathematical models (DEIM), University of Palermo, viale delle scienze - building 9, 90128, Italy; Department of Energy, Information engineering and Mathematical models (DEIM), University of Palermo, viale delle scienze - building 9, 90128, Italy; Department of Energy, Information engineering and Mathematical models (DEIM), University of Palermo, viale delle scienze - building 9, 90128, Italy; Department of Energy, Information engineering and Mathematical models (DEIM), University of Palermo, viale delle scienze - building 9, 90128, Italy","2014 Ninth International Conference on Ecological Vehicles and Renewable Energies (EVER)","","2014","","","1","6","In this paper, a modeling technique for PV panels oriented to power electronics design is proposed. Existing models usually aim at accurately matching only a few remarkable points of the solar panel characteristics. Yet, power electronics designers aim at simulating the entire panel characteristics as accurately as possible to test the efficiency of sophisticated control algorithms. Furthermore, existing parameters identification procedures are usually based on manufacturers' data and related to the knowledge of physical parameters of the solar cell under test. Manufacturers' data are usually incomplete and physical parameters are not readily available to power electronics designers. A five lumped parameter model is applied to a Sanyo HIT-240HDE4 solar module. Five parameters are derived from manufacturers' data. A four lumped parameter model whose parameters are derived by a novel fitting procedure is then applied to the same solar module. Simulation results of both models and manufacturers' curves are compared to test the accuracy of proposed identification procedure.","","978-1-4799-3787-5978-1-4799-3786","10.1109/EVER.2014.6844088","","https://ieeexplore.ieee.org/stamp/stamp.jsp?arnumber=6844088","renewable energy sources;photovoltaic array;solar energy;modeling and simulation","Educational institutions;Lead;Phase locked loops","curve fitting;network analysis;parameter estimation;power electronics;power system planning;solar cells","photovoltaic modules;power system design;modeling technique;PV panels;solar panel characteristics;power electronics designers;control algorithms;parameter identification procedures;manufacturer data;physical parameters;solar cell;Sanyo HIT-240HDE4 solar module;parameter model;fitting procedure","","8","","39","","","","","IEEE","IEEE Conferences"
"Enhanced aging model for supercapacitors taking into account power cycling: Application to the sizing of an Energy Storage System in a Direct Wave Energy Converter","T. Kovaltchouk; B. Multon; H. Ben Ahmed; J. Aubry; P. Venet","SATIE, UMR CNRS 8029, ENS Rennes, UEB, Bruz, France; SATIE, UMR CNRS 8029, ENS Rennes, UEB, Bruz, France; SATIE, UMR CNRS 8029, ENS Rennes, UEB, Bruz, France; Équipe mécatronique, ESTACA, Campus de Laval, France; AMPERE UMR CNRS 5005, Université Lyon 1, Université de Lyon, Villeurbanne, France","2014 Ninth International Conference on Ecological Vehicles and Renewable Energies (EVER)","","2014","","","1","10","This paper proposes an original model for supercapacitors that takes into account both calendar aging and cycling aging. This model is based on a series of recent experiments conducted in various research laboratories on the same technology (Maxwell Technology) and serves to represent the degradation of Equivalent Series Resistance and capacitance. We show that an accurate aging model is critical to the design of an Energy Storage System that optimizes the economic life cycle cost. Such an optimization is especially applicable for smoothing in offshore systems like Direct Wave Energy Converters, which require both cost reduction and high reliability. The influence of an aging model in the sizing process is investigated towards the end of this paper.","","978-1-4799-3787-5978-1-4799-3786","10.1109/EVER.2014.6844039","","https://ieeexplore.ieee.org/stamp/stamp.jsp?arnumber=6844039","Supercapacitors;Aging;Energy Storage Systems;Direct Wave Energy Converter;Power Smoothing;Power Cycling;Irregular Waves","Aging;Supercapacitors;Calendars;Mathematical model;Computational modeling;Laboratories","ageing;offshore installations;optimisation;power convertors;reliability;supercapacitors;wave power generation","direct wave energy converter;energy storage system;supercapacitors;power cycling;calendar aging;cycling aging;Maxwell technology;equivalent series resistance;equivalent series capacitance;economic life cycle cost;optimization;offshore systems;cost reduction;reliability","","8","","24","","","","","IEEE","IEEE Conferences"
"Techno-economic evaluation of alternative configurations for very large scale PV power systems including energy storage","A. Marinopoulos; P. Bakas","ABB AB, Corporate Research, Forskargränd 7, Västerås, SE-72178, Sweden; ABB AB, Corporate Research, Forskargränd 7, Västerås, SE-72178, Sweden","2014 Ninth International Conference on Ecological Vehicles and Renewable Energies (EVER)","","2014","","","1","7","PV systems are already mature, especially for small and medium size applications. However, in the last couple of years larger PV power plants in the range of 100MW have been installed and set in operation. An important question that arises for very large scale PV power systems is the optimization of the overall system configuration, especially due to the very high initial costs and the financing of such projects. Several concepts in the literature have been investigated regarding efficiency and technical feasibility; however it is also important to evaluate their economic feasibility, using commonly accepted metrics. In this paper four different system configurations are presented, with the typical system configuration of central inverters and medium voltage transformers used as a reference. The other three alternatives include high power DC-DC converters connected in series or in parallel, as well as cascaded DC-AC inverters. In addition, taking into account current developments in energy storage, new possibilities for combining PV with energy storage for large scale plants are rising, in order to deal with the grid integration of ever increasing PV installations. Therefore, a comparison is performed among a PV power plant with and without energy storage for different operation scenarios. The results show clearly the increase of cost and indicate the need for new evaluation metrics to include the expected benefits from the integration of energy storage to PV power systems.","","978-1-4799-3787-5978-1-4799-3786","10.1109/EVER.2014.6844135","","https://ieeexplore.ieee.org/stamp/stamp.jsp?arnumber=6844135","Very Large Scale PV systems;DC-DC Converter;Cascaded DC-AC;Energy Storage;Techno-economic evaluation;LCOE","Energy storage;Inverters;Power generation;Arrays;Economics;Measurement;Temperature sensors","DC-AC power convertors;DC-DC power convertors;invertors;photovoltaic power systems;power generation economics;power grids;power transformers;thermal energy storage","techno-economic evaluation;alternative configurations;very large scale PV power systems;energy storage;PV power plants;overall system configuration optimization;economic feasibility;technical feasibility;central inverters;medium voltage transformers;high power DC-DC converters;cascaded DC-AC inverters;grid integration;PV installations;power 100 MW","","7","","9","","","","","IEEE","IEEE Conferences"
"Experimental test on a Contactless Power Transfer system","F. Pellitteri; V. Boscaino; A. O. Di Tommaso; R. Miceli; G. Capponi","Department of Energy, Information engineering and Mathematical models, University of Palermo, Italy; Department of Energy, Information engineering and Mathematical models, University of Palermo, Italy; Department of Energy, Information engineering and Mathematical models, University of Palermo, Italy; Department of Energy, Information engineering and Mathematical models, University of Palermo, Italy; Department of Energy, Information engineering and Mathematical models, University of Palermo, Italy","2014 Ninth International Conference on Ecological Vehicles and Renewable Energies (EVER)","","2014","","","1","6","Contactless Power Transfer (CPT) is an ever-growing technology in automotive market, due to the significant improvement brought by it to battery charging operation in terms of safety and comfort. CPT is based on inductive coupling between two coils, so that power cords can be avoided for vehicles battery charging and an important contribution towards a smarter mobility can arise. In this paper, a CPT prototype for E-bike is proposed. Magnetic design and power electronics system are described. Experimental results deriving from laboratory tests are presented and power efficiency of the system is addressed.","","978-1-4799-3787-5978-1-4799-3786","10.1109/EVER.2014.6844092","","https://ieeexplore.ieee.org/stamp/stamp.jsp?arnumber=6844092","contactless power transfer;wireless battery charging;inductive power transfer;vehicular technologies","Laboratories;Magnetic resonance;Batteries;Atmospheric modeling;Biological system modeling;Power electronics","battery powered vehicles;coils;inductive power transmission;secondary cells","contactless power transfer system;automotive market;battery charging operation;inductive coupling;coils;vehicle battery charging;mobility;CPT prototype;E-bike;magnetic design;power electronics system;power efficiency","","5","","31","","","","","IEEE","IEEE Conferences"
"Sensor applications in charging stations for electric vehicles","M. Schael; I. Stoychev; A. Bouabana; A. Feiler; J. Oehm; C. Sourkounis","Ruhr-University Bochum, Institute of Power Systems Technology and Power Mechatronics, 44780, Germany; Ruhr-University Bochum, Analogue Integrated Circuits Research Group, 44780, Germany; Ruhr-University Bochum, Institute of Power Systems Technology and Power Mechatronics, 44780, Germany; Ruhr-University Bochum, Analogue Integrated Circuits Research Group, 44780, Germany; Ruhr-University Bochum, Analogue Integrated Circuits Research Group, 44780, Germany; Ruhr-University Bochum, Institute of Power Systems Technology and Power Mechatronics, 44780, Germany","2014 Ninth International Conference on Ecological Vehicles and Renewable Energies (EVER)","","2014","","","1","7","A safe and secure charging process for electric vehicles is a prerequisite for an increasing share of electromobility in the traffic sector. A sensor system for a single phase charging station is developed that fulfils different requirements. These application requirements are evaluated and the selected special current and voltage sensors are explained. Several simulations for the signal processing are presented that serve as a basis for the individual decision regarding the needed data rate and precision for the different application requirements.","","978-1-4799-3787-5978-1-4799-3786","10.1109/EVER.2014.6844099","","https://ieeexplore.ieee.org/stamp/stamp.jsp?arnumber=6844099","electric vehicle;charging station;current sensor;voltage sensor;sensing postprocessing","Voltage measurement;Charging stations;Optical variables measurement;Accuracy;Sensor systems;Electric vehicles;Current measurement","battery powered vehicles;electric sensing devices","electric vehicles;mechatronics charging process;traffic sector electromobility;single phase charging station;current sensors;voltage sensors","","3","","8","","","","","IEEE","IEEE Conferences"
"Design and realization of a quadricycle for urban mobility","F. Castelli-Dezza; G. Galmarini; M. Gobbi; M. Mauri","Dipartimento di Meccanica, Politecnico di Milano, Via La Masa 1, 20156, ITALY; Dipartimento di Meccanica, Politecnico di Milano, Via La Masa 1, 20156, ITALY; Dipartimento di Meccanica, Politecnico di Milano, Via La Masa 1, 20156, ITALY; Dipartimento di Meccanica, Politecnico di Milano, Via La Masa 1, 20156, ITALY","2014 Ninth International Conference on Ecological Vehicles and Renewable Energies (EVER)","","2014","","","1","8","The need to decrease pollution in urban zones has pushed toward severe regulations in term of low-emission limits. The effect of this “environmental awareness” is an increased interest in Light Electric Vehicles (LEV). The construction of a LEV is presented in this paper. This vehicle has been designed specifically to be powered by electric motors, the suspension system and the general layout have been developed accordingly. The main features of GreenFun, (this is the name of the prototype), are an extensive use of composite and lightweight materials, a special suspension system layout, a 4WD powertrain realized by means of 4 electric motor hubs and the use, for the first time in a production vehicle, of 4 measuring wheels that are able to measure the forces acting between the pneumatic tires and the road. These information are used as input for the vehicle control systems in order to enhance performance and safety.","","978-1-4799-3787-5978-1-4799-3786","10.1109/EVER.2014.6844112","","https://ieeexplore.ieee.org/stamp/stamp.jsp?arnumber=6844112","Light Electric Vehicle;Dynamometric Hub;Electronic Differential;Traction control","Vehicles;Wheels;Batteries;Green products;Suspensions;Force;Generators","air pollution;electric control equipment;electric motors;electric vehicles","vehicle control systems;pneumatic tires;measuring wheels;production vehicle;electric motor hubs;4WD powertrain;special suspension system layout;lightweight materials;composite materials;GreenFun;electric motors;LEV;Light Electric Vehicles;environmental awareness effect;low-emission limits;urban mobility;quadricycle realization;quadricycle design","","1","","14","","","","","IEEE","IEEE Conferences"
"Life Cycle Assessment of the Wavestar","G. Dalton; D. Madden; M. C. Daly","Beaufort HMRC, UCC, Cork Ireland; Beaufort HMRC, UCC, Cork Ireland; Beaufort HMRC, UCC, Cork Ireland","2014 Ninth International Conference on Ecological Vehicles and Renewable Energies (EVER)","","2014","","","1","9","This case study will quantify the energy use, the carbon caused by Green House Gases and the sum of the costs for the entire life cycle (Life Cycle Assessment (LCA) and a Life Cycle Cost Analysis (LCCA)), using the WaveStar as the wave energy case study device. Life Cycle covers all stages in a product's life from Cradle to grave; the extraction of raw materials from the earth and ends with their ultimate disposal when all materials are returned to the earth. Phases of the life cycle for WaveStar were compiled and the inputs and outputs for the given stage in the life cycle were quantified. Inventory analysis involved data collection and calculation procedures to quantify relevant inputs and outputs of a product system. Results were compared to similar studies for other ocean renewable as well as conventional fossil fuel sources. Results indicated that LCC of wave energy is comparable to offshore wind, but much higher hat onshore wind and other competing fossil fuels.","","978-1-4799-3787-5978-1-4799-3786","10.1109/EVER.2014.6844034","","https://ieeexplore.ieee.org/stamp/stamp.jsp?arnumber=6844034","LCA;LCCA;Cradle-Grave;Energy Intensity;Carbon Payback;Life Cycle Cost","Wind turbines;Materials;Carbon;Carbon dioxide;Steel;Production;Global warming","air pollution;life cycle costing;offshore installations;product life cycle management;raw materials;wave power plants","life cycle assessment;Wavestar;green house gases;LCA;life cycle cost analysis;LCCA;wave energy case study device;raw material extraction;inventory analysis;data collection;data calculation procedure;ocean renewable energy;offshore wind;onshore wind;wave energy converters","","2","","29","","","","","IEEE","IEEE Conferences"
"Piezoelectric model of rainfall energy harvester","F. Viola; P. Romano; R. Miceli; G. Acciari; C. Spataro","Università degli Studi di Palermo, Viale delle Scienze, edificio 9, Italy; Università degli Studi di Palermo, Viale delle Scienze, edificio 9, Italy; Università degli Studi di Palermo, Viale delle Scienze, edificio 9, Italy; Università degli Studi di Palermo, Viale delle Scienze, edificio 9, Italy; Università degli Studi di Palermo, Viale delle Scienze, edificio 9, Italy","2014 Ninth International Conference on Ecological Vehicles and Renewable Energies (EVER)","","2014","","","1","7","In this paper a model to predict the harvest of the energy contained in rainfall by means of piezoelectric transducers is presented. Different studies agree on the level of suitable generated voltage on the electrodes of a piezoelectric transducer subjected to rainfall, but a complete characterization on the supplied power is still missing. This work, in order to limit optimistic forecasts, compares the behavior of the transducers subjected to real and artificial rainfall, a condition that has shown promising behavior in laboratory.","","978-1-4799-3787-5978-1-4799-3786","10.1109/EVER.2014.6844093","","https://ieeexplore.ieee.org/stamp/stamp.jsp?arnumber=6844093","energy harvester;piezoelectric effect","Stress;Vibrations;Electric fields;Piezoelectric transducers;Piezoelectric materials;Strain","energy harvesting;piezoelectric transducers;rain","piezoelectric model;rainfall energy harvester;piezoelectric transducer;supplied power characterization","","14","","45","","","","","IEEE","IEEE Conferences"
"Design of rear wheel torque vectoring for dual motor Electric drive system","B. Rao Munusamy; J. D. Weigl","Design Centric Programme, Faculty of Engineering, National University of Singapore, Block E1A, #03-03, 1 Engineering Drive 2, Singapore 117576; Engineering Design & Innovation Centre, Faculty of Engineering, National University of Singapore, Block E1A, #03-03, 1 Engineering Drive 2, Singapore 117576","2014 Ninth International Conference on Ecological Vehicles and Renewable Energies (EVER)","","2014","","","1","20","This paper is aimed at providing an insight into the torque vectoring concept which will be incorporated into the dual-motor drive system of the Electric Arc vehicle. The torque vectoring algorithm is based on Ackerman steering geometry and will become the basis of electronic differential which will vary the speed of the two rear driving wheels while cornering. The electronic differential acquires steering and vehicle speed data before computing the corresponding cornering response for each rear driving wheel using yaw rate prediction from the Ackerman steering geometry. Several series of Excel simulations were done to illustrate neutral steer, understeer and oversteer cornering cases for different cornering radius with varying vehicle speed and the cornering responses for each case was analyzed. This paper will also highlight how on-track testing of Electric Arc can verify the Excel simulation results and consequently determine tire cornering properties.","","978-1-4799-3787-5978-1-4799-3786","10.1109/EVER.2014.6844114","","https://ieeexplore.ieee.org/stamp/stamp.jsp?arnumber=6844114","Traction control;wheel hub motor;simulation;torque;calculation","Vehicles;Wheels;Tires;Torque;Geometry;Traction motors;Brushless DC motors","electric vehicles;geometry;machine vector control;steering systems;torque control;traction motor drives","torque vectoring concept;dual-motor drive system;Electric Arc vehicle;Ackerman steering geometry;electronic differential;rear driving wheels;steering data;vehicle speed data;cornering response;yaw rate prediction;Excel simulations;neutral steer cornering cases;understeer cornering cases;oversteer cornering cases;cornering radius;on-track testing;tire cornering properties","","3","","10","","","","","IEEE","IEEE Conferences"
