"Thermal management optimization of a heat-pump-based HVAC system for cabin conditioning in electric vehicles","G. De Nunzio; A. Sciarretta; A. Steiner; A. Mladek","IFP Energies nouvelles, 1 et 4 avenue de Bois-Préau, 92852 Rueil-Malmaison, France; IFP Energies nouvelles, 1 et 4 avenue de Bois-Préau, 92852 Rueil-Malmaison, France; Virtual Vehicle Research Center, Inffeldgasse 21a, A-8010 Graz, Austria; Virtual Vehicle Research Center, Inffeldgasse 21a, A-8010 Graz, Austria","2018 Thirteenth International Conference on Ecological Vehicles and Renewable Energies (EVER)","","2018","","","1","7","One of the biggest barriers towards large scale adoption of electric and plug-in hybrid cars is still range limitation due to limited storage capacity of electric batteries. The air conditioning system for passenger comfort and the thermal conditioning system (battery and powertrain) are critical auxiliary consumers in electric vehicles with respect to energy consumption. Therefore, the Horizon 2020 project “OPTEMUS” proposes to tackle this bottleneck by leveraging heat pump technology and a holistic thermal system optimization approach. This paper presents the optimization strategy used for energy-efficient cabin conditioning in cold weather condition and simulation results of the air conditioning system including a heat pump. This system is capable of using the ambient air or a preconditioned battery as heat source, thus significantly reducing overall energy consumption.","","978-1-5386-5966-3978-1-5386-5965-6978-1-5386-5967","10.1109/EVER.2018.8362408","","https://ieeexplore.ieee.org/stamp/stamp.jsp?arnumber=8362408","electric vehicles;passenger comfort;thermal conditioning;heat pump system;optimization","Heat pumps;Heating systems;Batteries;Optimization;Atmospheric modeling;Integrated circuit modeling;Coolants","air conditioning;battery powered vehicles;electric vehicles;energy conservation;heat pumps;HVAC;power transmission (mechanical);thermal management (packaging)","cold weather condition;air conditioning system;preconditioned battery;heat source;energy consumption;thermal management optimization;electric vehicles;electric plug-in hybrid cars;electric batteries;powertrain;critical auxiliary consumers;Horizon 2020 project OPTEMUS;heat pump technology;holistic thermal system optimization approach;energy-efficient cabin conditioning;heat-pump-based HVAC system;thermal conditioning system","","","","12","","","","","IEEE","IEEE Conferences"
"Soft-landing control of low-energy solenoid valve actuators","J. R. M. van Dam; B. L. J. Gysen; E. A. Lomonova; M. Dhaens","Eindhoven University of Technology, Department of Electrical Engineering, Eindhoven 5612 AP, The Netherlands; Eindhoven University of Technology, Department of Electrical Engineering, Eindhoven 5612 AP, The Netherlands; Eindhoven University of Technology, Department of Electrical Engineering, Eindhoven 5612 AP, The Netherlands; Tenneco Automotive Europe BVBA, Advanced Chassis Research, B 3800 Sint-Truiden, Belgium","2018 Thirteenth International Conference on Ecological Vehicles and Renewable Energies (EVER)","","2018","","","1","5","An automotive, fluid-control solenoid valve is composed of an electromagnetic reluctance actuator and a near-constant-force spring. Its motion profile is characterized by short closed-to-open transition times which demand fast switching, while valve lifetime improves by minimizing the impact velocity, i.e. a soft landing. In this paper, a cascaded position- and current-feedback control is designed and implemented on nonlinear, axisymmetric magnetostatic finite element simulations of a low-energy solenoid valve actuator. By applying the cascaded control, actuator performance is improved considerably, as a soft landing, a timely actuation, and an increased energy-efficient device have been obtained.","","978-1-5386-5966-3978-1-5386-5965-6978-1-5386-5967","10.1109/EVER.2018.8362372","","https://ieeexplore.ieee.org/stamp/stamp.jsp?arnumber=8362372","Actuators;Control;Magnetostatic","Actuators;Valves;Magnetostatics;Force;Table lookup;Magnetic cores;Electromagnetics","automotive components;cascade control;control system synthesis;electromagnetic actuators;feedback;finite element analysis;motion control;position control;solenoids;springs (mechanical);switching systems (control);valves","soft-landing control;low-energy solenoid valve actuator;automotive fluid-control solenoid valve;electromagnetic reluctance actuator;near-constant-force spring;closed-to-open transition times;valve lifetime;soft landing;nonlinear element simulations;cascaded control;actuator performance;timely actuation;motion profile;fast switching;impact velocity minimization;cascaded position-feedback control design;current-feedback control design;nonlinear axisymmetric magnetostatic finite element simulations;energy-efficient device","","1","","9","","","","","IEEE","IEEE Conferences"
"Electrified boosting systems in today's and future automotive applications","G. Spinner; F. Dahinten; S. Dauscher; S. Münz","BorgWarner Turbo Systems Engineering GmbH, Marnheimer Straße 85/87, 67292 Kirchheimbolanden; BorgWarner Turbo Systems Engineering GmbH, Marnheimer Straße 85/87, 67292 Kirchheimbolanden; BorgWarner Turbo Systems Engineering GmbH, Marnheimer Straße 85/87, 67292 Kirchheimbolanden; BorgWarner Turbo Systems Engineering GmbH, Marnheimer Straße 85/87, 67292 Kirchheimbolanden","2018 Thirteenth International Conference on Ecological Vehicles and Renewable Energies (EVER)","","2018","","","1","5","Increasing demands to fulfil future emissions legislation in the passenger car sector needs a continuous increase of efficiency of the internal combustion engine. Also a cut in raw emissions is a major challenge. An important step toward local emission free vehicles are hybrid vehicles with many variants of the degree of electrification. BorgWarner takes this challenge by continuously adapting the product portfolio in regards to mechatronic and pure electrical products.","","978-1-5386-5966-3978-1-5386-5965-6978-1-5386-5967","10.1109/EVER.2018.8362365","","https://ieeexplore.ieee.org/stamp/stamp.jsp?arnumber=8362365","eBooster®;eTurbo™;fuel cell air supply;electric driven compressor;electric assisted turbo charger","Engines;Torque;Fuel cells;Electric motors;Acceleration;Turbines;Petroleum","air pollution control;automobiles;automotive components;fuel systems;hybrid electric vehicles;internal combustion engines","hybrid vehicles;passenger car sector;internal combustion engine;raw emissions;local emission free vehicles;automotive applications;electrified boosting systems;emission legislation","","","","5","","","","","IEEE","IEEE Conferences"
"A novel method for harmonic mitigation for single-phase five-level cascaded H-Bridge inverter","A. O. Di Tommaso; P. Livreri; R. Miceli; G. Schettino; F. Viola","Department of Energy, Information Engineering and Mathematical Models (DEIM), Polytechnic School, University of Palermo, 90128 Palermo, Italy; Department of Energy, Information Engineering and Mathematical Models (DEIM), Polytechnic School, University of Palermo, 90128 Palermo, Italy; Department of Energy, Information Engineering and Mathematical Models (DEIM), Polytechnic School, University of Palermo, 90128 Palermo, Italy; Department of Energy, Information Engineering and Mathematical Models (DEIM), Polytechnic School, University of Palermo, 90128 Palermo, Italy; Department of Energy, Information Engineering and Mathematical Models (DEIM), Polytechnic School, University of Palermo, 90128 Palermo, Italy","2018 Thirteenth International Conference on Ecological Vehicles and Renewable Energies (EVER)","","2018","","","1","7","The efficiency of a system is a very important parameter for high power electrical drives applications. Moreover, the efficiency of power converters plays a fundamental role. Aim of this work, is to propose a novel selective harmonic mitigation method without solving non-linear equations. Through a very simple approach, the polynomial equations which drive the control angles have been detected for a single-phase five-level cascaded H-Bridge inverter. The obtained polynomial equations can be easily implemented in a digital system to real-time operation. The paper also presents the simulation analysis and experimental validation.","","978-1-5386-5966-3978-1-5386-5965-6978-1-5386-5967","10.1109/EVER.2018.8362347","","https://ieeexplore.ieee.org/stamp/stamp.jsp?arnumber=8362347","Cascaded H-bridge multilevel inverter;selective harmonic mitigation;High power electrical drive","Harmonic analysis;Mathematical model;Market research;Inverters;Voltage control;Switches;Bridge circuits","harmonics suppression;invertors;polynomials","high power electrical drives applications;power converters;nonlinear equations;polynomial equations;digital system;selective harmonic mitigation method;single-phase five-level cascaded H-bridge inverter","","2","","14","","","","","IEEE","IEEE Conferences"
"Integration of offshore wind energy into an island grid by means of a Multi-Terminal VSC-HVDC network","M. Haro-Larrode; M. Santos-Mugica; A. Etxegarai; P. Eguia","Tecnalia Research and Innovation, Parque Tecnológico de Vizcaya, Edificio 700, Derio, 48160, Spain; Tecnalia Research and Innovation, Parque Tecnológico de Vizcaya, Edificio 700, Derio, 48160, Spain; The University of The Basque Country, Department of Electrical Engineering, Alameda Urquijo s/n, Bilbao, 48013, Spain; The University of The Basque Country, Department of Electrical Engineering, Alameda Urquijo s/n, Bilbao, 48013, Spain","2018 Thirteenth International Conference on Ecological Vehicles and Renewable Energies (EVER)","","2018","","","1","6","In this paper, the connection of two offshore wind-farms to an island grid through a Multi-Terminal HVDC (MTDC) link is examined. The control strategy of the MTDC grid is validated against several adverse fault cases occurring at the island grid side. For this purpose an electrical grid model based on a medium size island is used to test the control structure of the MTDC link under faults such as voltage dips and frequency deviations. Simulation results are also presented thereby, pointing out interaction issues between control schemes of the MTDC and island grid. Thus, the participation of the MTDC network to increase the flexibility of the interconnected electrical system stands out in the present work.","","978-1-5386-5966-3978-1-5386-5965-6978-1-5386-5967","10.1109/EVER.2018.8362339","","https://ieeexplore.ieee.org/stamp/stamp.jsp?arnumber=8362339","offshore wind;Multi-Terminal HVDC;electrical grid;voltage dips;frequency deviations;flexibility","Frequency control;Phase locked loops;Time-frequency analysis;Power system stability;Voltage control;Stability analysis;Voltage fluctuations","HVDC power convertors;HVDC power transmission;offshore installations;power grids;power transmission control;wind power plants","island grid side;MTDC link;MTDC network;offshore wind energy;MultiTerminal VSC-HVDC network;offshore wind-farms;MultiTerminal HVDC link;MTDC grid","","","","9","","","","","IEEE","IEEE Conferences"
"Space vector modulation for 17-level cascaded H-bridge inverter for use in battery energy storage systems","T. Lahlou; V. I. Muresan; I. Bolvashenkov; H. G. Herzog","Institute of Energy Conversion Technology, Technical University of Munich (TUM), Munich, Germany; Institute of Energy Conversion Technology, Technical University of Munich (TUM), Munich, Germany; Institute of Energy Conversion Technology, Technical University of Munich (TUM), Munich, Germany; Institute of Energy Conversion Technology, Technical University of Munich (TUM), Munich, Germany","2018 Thirteenth International Conference on Ecological Vehicles and Renewable Energies (EVER)","","2018","","","1","6","Renewable energies have experienced a large growth in the past years. The increasing demand on renewable energy sources, requires more efficient converting and energy storage systems. The multilevel inverter shows in comparison to 2-level inverter topologies higher efficiency and the control of this inverter offers several advantages. Thus, a Space Vector Modulation scheme for a 17-level Cascaded H-Bridge inverter has been studied in detail, simulated in Simulink using the Simscape Power Systems toolbox, and within this paper presented. Finally, on the merits of simulation results, a comparison between Space Vector Modulation and Level Shifted Phase Disposition Pulse Width Modulation is given.","","978-1-5386-5966-3978-1-5386-5965-6978-1-5386-5967","10.1109/EVER.2018.8362379","","https://ieeexplore.ieee.org/stamp/stamp.jsp?arnumber=8362379","Space Vector Modulation;SVM;Cascaded H-Bridge inverter;CHB;Battery Energy Storage System;BESS;efficiency","Inverters;Switches;Aerospace electronics;Support vector machines;Harmonic analysis;Pulse width modulation","energy storage;power engineering computing;PWM invertors;renewable energy sources;secondary cells","17-level cascaded H-bridge inverter;battery energy storage systems;renewable energy sources;multilevel inverter;2-level inverter topologies;Simscape Power Systems toolbox;space vector modulation scheme;Simulink;level shifted phase disposition pulse width modulation","","","","31","","","","","IEEE","IEEE Conferences"
"Mosfets used in ideal diode circuits for Lundell alternator rectifiers","A. Van den Bossche; S. Haddad; D. Petrov; V. Valchev","EELAB Ghent University, Technologiepark 913, 9052 Gent Belgium; Département de génie mécanique, Université 20 aoÛt 1955, Skikda Algeria; Department of Electronics, Technical University of Varna; Department of Electronics, Technical University of Varna","2018 Thirteenth International Conference on Ecological Vehicles and Renewable Energies (EVER)","","2018","","","1","5","Low voltage power applications suffer from losses in diode voltage drops. For example, the Lundell car alternator has a low efficiency, partly due to a high-current diode voltage drop of 1.1V, being 2.2V in a bridge configuration, resulting in 15% of output voltage and corresponding losses. Schottky diodes have a lower drop, but are quite fragile and seem not to be preferred in that application. This paper proposes a two terminal circuit with a MOSFET, which emulates a diode while having a very low voltage drop. The main item is that the MOSFET is turned on at a small negative drain-source voltage. This could be done using an op-amp circuit, but the used transistor array circuit can have a lower current consumption. At full load, some 73% voltage drop reduction is possible, for example while using a MOSFET of max. 0.003 ohm on-resistance at 125°C, hence the voltage drop at 100 A can be limited to 0.3 V. At a rather typical 30A DC-current load, some 87% voltage drop reduction is possible, 100mV drop compared to 0.8V for a diode. The solution costs hardly more than the usual “press-fit” diodes. The circuit has a short paid back time, by the lower use of aluminum for the heat sink and the fuel saving. In large quantity such MOSFET can cost less than 0.5 Euro, and the cost of the circuit is not larger.","","978-1-5386-5966-3978-1-5386-5965-6978-1-5386-5967","10.1109/EVER.2018.8362385","","https://ieeexplore.ieee.org/stamp/stamp.jsp?arnumber=8362385","Ideal diode;energy saving;automotive;Lundell alternator;energy saving","","alternators;automotive electronics;electric potential;low-power electronics;MOSFET circuits;operational amplifiers;rectifying circuits;Schottky diodes;semiconductor device models","ideal diode circuits;Lundell alternator rectifiers;low voltage power applications;diode voltage drops;Lundell car alternator;high-current diode voltage drop;schottky diodes;terminal circuit;MOSFET;low voltage drop;negative drain-source voltage;op-amp circuit;transistor array circuit;DC-current load;current consumption;voltage drop reduction;press-fit diodes;heat sink;temperature 125.0 degC;voltage 1.1 V;voltage 2.2 V;resistance 0.003 ohm;current 100.0 A","","","","10","","","","","IEEE","IEEE Conferences"
"Optimal operation of PV-diesel-battery MG based on fuzzy comprehensive evaluation","Q. Zhang; J. Ding; G. Li","Anhui University, Department of Electrical Engineering and Automation, 230601 Hefei, China; Anhui Electric Power Research Institute, 230061 Hefei, China; AHU, Engineering Research Center of Power Quality, Ministry of Education, 230601 Hefei, China","2018 Thirteenth International Conference on Ecological Vehicles and Renewable Energies (EVER)","","2018","","","1","5","This paper focuses on the environmental and economic optimal operation of microgrid (MG) in various scenarios. An AC/DC hybrid MG including photovoltaic, diesel generator, lithium battery, electric vehicle charging points is analyzed. Considering the operation constrains of MG, a constrained multi-objective optimization problem (CMOP) is built. The optimization objectives of the proposed CMOP are the fuel cost, depreciation expense and emission cost of distributed generators. The fuzzy comprehensive evaluation is introduced for conversion from the multi-objective problem to a single-objective one. Then the comprehensive learning particle swarm optimization (CLPSO) is applied for the solutions of distributed generators' outputs. Optimization results in grid-connected and islanded modes demonstrate the effectiveness of the proposed models, methods, and algorithm.","","978-1-5386-5966-3978-1-5386-5965-6978-1-5386-5967","10.1109/EVER.2018.8362332","","https://ieeexplore.ieee.org/stamp/stamp.jsp?arnumber=8362332","MG;economic optimal operation;fuzzy comprehensive evaluation;comprehensive learning particle swarm optimization","Generators;Lithium batteries;Power generation;Cost function;State of charge","AC-DC power convertors;battery storage plants;diesel-electric generators;diesel-electric power stations;distributed power generation;fuzzy set theory;hybrid power systems;particle swarm optimisation;photovoltaic power systems","PV-diesel-battery MG;fuzzy comprehensive evaluation;diesel generator;lithium battery;electric vehicle;distributed generators;constrained multiobjective optimization problem;particle swarm optimization","","","","12","","","","","IEEE","IEEE Conferences"
"Development of a process for a customized vehicle testing for new vehicle concepts in new markets — Application example Sub-Saharan Africa","S. Koberstaedt; M. Eiba; M. Huber; S. Kalt; M. Šoltés; M. Lienkamp","Institute of Automotive Technology, Technical University of Munich, Boltzmannstraße 15 85748 Garching, Germany; Institute of Automotive Technology, Technical University of Munich, Boltzmannstraße 15 85748 Garching, Germany; Institute of Automotive Technology, Technical University of Munich, Boltzmannstraße 15 85748 Garching, Germany; Institute of Automotive Technology, Technical University of Munich, Boltzmannstraße 15 85748 Garching, Germany; Institute of Automotive Technology, Technical University of Munich, Boltzmannstraße 15 85748 Garching, Germany; Institute of Automotive Technology, Technical University of Munich, Boltzmannstraße 15 85748 Garching, Germany","2018 Thirteenth International Conference on Ecological Vehicles and Renewable Energies (EVER)","","2018","","","1","11","More and more new vehicle concepts are flooding the new market in areas worldwide. However, existing vehicle concepts from other markets can not simply be transferred due to the completely different user requirements and existing boundary conditions. For example, Africa is a continent with one billion people without its own appreciable automobile market. This paper deals with a process model to define a customized overall vehicle testing method for new vehicle concepts in new markets, which is validated by a prototype for the region Sub-Saharan Africa.","","978-1-5386-5966-3978-1-5386-5965-6978-1-5386-5967","10.1109/EVER.2018.8362388","","https://ieeexplore.ieee.org/stamp/stamp.jsp?arnumber=8362388","vehicle testing;electric vehicle;test optimization;test categories;test content;new vehicle concept;vehicle requirements and boundary conditions;load collectives","Testing;Boundary conditions;Optimization;Stress;Product development;Prototypes;Africa","automobile industry;automobiles;road vehicles;testing","customized overall vehicle testing method;customized vehicle testing;boundary conditions;automobile market;Sub-Saharan Africa region;user requirements;vehicle concepts","","","","21","","","","","IEEE","IEEE Conferences"
"XERIC climate-control system for energy-efficient electric vehicles: First experimental results and numerical evaluation of the overall performance","C. Isetti; E. Nannei; S. Lazzari; B. Cerrai; S. Nari","TICASS, Innovative Technologies for Environmental Control and Sustainable Development, Via D. Fiasella, 3/16 Genoa, Italy; TICASS, Innovative Technologies for Environmental Control and Sustainable Development, Via D. Fiasella, 3/16 Genoa, Italy; DAD, Department of Architecture and Design, University of Genoa, Stradone S. Agostino, 37 - 16123 Genoa, Italy; FRIGOMAR, Marine Refrigeration and Air Conditioning Systems, Via V. Veneto, 16042 Carasco, Genoa, Italy; FRIGOMAR, Marine Refrigeration and Air Conditioning Systems, Via V. Veneto, 16042 Carasco, Genoa, Italy","2018 Thirteenth International Conference on Ecological Vehicles and Renewable Energies (EVER)","","2018","","","1","6","The paper reports the main developments and results achieved so far within the EU-funded H2020 XERIC project, which is aimed at developing a new climate control system that is able to increase Battery Electric Vehicles (BEVs) autonomy thanks to its high energy efficiency. The XERIC system combines a traditional Vapor Compression Cycle (VCC) with a Liquid Desiccant Cycle (LDC), by taking advantage of an innovative component, called Three-Fluids Combined Membrane Contactor (3F-CMC). The two experimental setups arranged to test LDC alone and the overall XERIC system are presented. Then, the experimental results obtained in the first test campaign are given and discussed. Finally, the numerical tool developed in the Matlab/Simulink environment for the evaluation of the performance of the overall XERIC system is introduced and a preliminary comparison between numerical results and experimental measurements is provided.","","978-1-5386-5966-3978-1-5386-5965-6978-1-5386-5967","10.1109/EVER.2018.8362410","","https://ieeexplore.ieee.org/stamp/stamp.jsp?arnumber=8362410","XERIC project;Hybrid systems for air conditioning;liquid desiccant cycle;innovative membrane contactors;energy-efficient electric vehicles;AC mobile system","Liquids;Prototypes;Heat transfer;Resistance heating;Refrigerants;Valves","battery powered vehicles;energy conservation","XERIC climate-control system;energy-efficient electric vehicles;climate control system;XERIC system;Liquid Desiccant Cycle;Battery Electric Vehicles","","","","11","","","","","IEEE","IEEE Conferences"
