"A modular approach in teaching thyristor rectifiers with equation-oriented softwares","A. O. Di Tommaso; F. Genduso; R. Miceli","DEIM, Department of Energy, Information engineering and Mathematical modeling, University of Palermo, Italy; DEIM, Department of Energy, Information engineering and Mathematical modeling, University of Palermo, Italy; DEIM, Department of Energy, Information engineering and Mathematical modeling, University of Palermo, Italy","2014 Ninth International Conference on Ecological Vehicles and Renewable Energies (EVER)","","2014","","","1","7","This article is devoted to some issues of teaching power electronics in university courses. In the modern education system the students are expected to be no longer subject of passive learning, but that, within a certain extent, they collaborate in their training interactively with the teacher to develop the applications and the topics of the studied framework. For this purpose, this article presents a modular approach for teaching module regarding three-phase thyristor rectifiers. A simulator based on the MATLAB equation solver has been developed by considering the detailed physical operation of such converters. In particular, the realized simulator takes various aspects into account, including continuous and discontinuous, commutation, its effect on the supply network and control parameters variations. The software modularity considers a very simple starting point and allows the extension to more complex topologies (bidirectional converters, cycloconverters and so on), maintaining always the same level of interaction with the students so that they can increase their skills and develop their own self-learning capability and self-training strategies.","","978-1-4799-3787-5978-1-4799-3786","10.1109/EVER.2014.6844096","","https://ieeexplore.ieee.org/stamp/stamp.jsp?arnumber=6844096","Modular teaching approach;Power electronics;converters;Equation oriented simulation software","Mathematical model;Equations;Integrated circuit modeling;Rectifiers","commutation;educational courses;mathematics computing;power electronics;rectifying circuits;teaching;thyristor convertors;training;unsupervised learning","self-training strategy;self-learning capability;cycloconverters;bidirectional converters;complex topology;control parameters variations;supply network;discontinuous commutation;continuous commutation;physical operation;Matlab equation solver;three-phase thyristor rectifiers;teaching module;passive learning;modern education system;university courses;teaching power electronics;equation-oriented softwares;teaching thyristor rectifiers;modular approach","","","","30","","","","","IEEE","IEEE Conferences"
"Control of wind turbine based on DFIG using Fuzzy-PI and Sliding Mode controllers","B. Hamane; M. L. Doumbia; M. Bouhamida; M. Benghanem","Department of Electrical and Computer Engineering, Université du Québec à Trois-Rivières, Canada; Department of Electrical and Computer Engineering, Université du Québec à Trois-Rivières, Canada; Department of Electrical Engineering, University Mohamed Boudiaf, Oran, Algeria; Department of Electrical Engineering, University Mohamed, Boudiaf, Oran, Algeria","2014 Ninth International Conference on Ecological Vehicles and Renewable Energies (EVER)","","2014","","","1","8","This paper presents the study of a wind energy conversion system (WECS) based on a doubly fed induction generator (DFIG) connected to electric power grid. The performances (reference tracking and robustness) of classical Proportional-Integral (PI), Fuzzy-PI and Sliding Mode (SM) controllers are compared with respect to the wind speed fluctuation and the impact on the produced energy quality. Moreover, direct vector control with stator flux orientation of the DFIG is used to control the active and reactive powers between the stator and the grid. The performances of the system were analyzed and compared by simulation using Matlab/Simulink/SimPower Systems.","","978-1-4799-3787-5978-1-4799-3786","10.1109/EVER.2014.6844060","","https://ieeexplore.ieee.org/stamp/stamp.jsp?arnumber=6844060","WECS;DFIG;Direct Vector Control;Fuzzy-PI controller;Sliding Mode","Reactive power;Stators;Rotors;Mathematical model;Wind energy;Robustness;Equations","asynchronous generators;fuzzy control;machine vector control;PI control;reactive power control;stators;variable structure systems;wind turbines","wind energy conversion system;WECS;doubly fed induction generator;DFIG;electric power grid;reference tracking;robustness;classical proportional-integral controllers;fuzzy-PI controllers;sliding mode controllers;wind speed fluctuation;produced energy quality;direct vector control;stator flux orientation;reactive power control;Matlab;Simulink;SimPower Systems;wind turbine","","3","","19","","","","","IEEE","IEEE Conferences"
"Design and magnetic noise reduction of the surface permanent magnet synchronous machine","M. Fakam; M. Hecquet; V. Lanfranchi","L2EP - Ecole Centrale de Lille, Cité scientifique, 59651 Villeneuve d'Ascq, France; L2EP - Ecole Centrale de Lille, Cité scientifique, 59651 Villeneuve d'Ascq, France; LEC - UTC, BP 20529, 60205 Compiègne Cedex, France","2014 Ninth International Conference on Ecological Vehicles and Renewable Energies (EVER)","","2014","","","1","9","Nowadays, the development of the electric motorization for the land vehicles is essential since the energetic challenge is become very critical. Electrical machines dedicated to this operating segment have some specifics of torque characteristics (high saturation level, important flux weakening) over the speed range. This paper presents the development of a tool used for the optimal acoustic and electromechanical modeling which stands out from standard analytical and Finite Element modeling respectively because of a high accuracy of calculations and a quickness of the resolution. Some results of comparison between acoustic measurement and simulation for different speed will be presented.","","978-1-4799-3787-5978-1-4799-3786","10.1109/EVER.2014.6844048","","https://ieeexplore.ieee.org/stamp/stamp.jsp?arnumber=6844048","Magnetic noise;vibrations;Maxwell pressures;airgap permeance;pulsewidth modulation;distributed and concentrated windings;permanent magnets","Air gaps;Atmospheric modeling;Stators;Rotors;Magnetic flux;Numerical models;Analytical models","acoustic measurement;electric vehicles;finite element analysis;magnetic noise;permanent magnet machines;synchronous machines","magnetic noise reduction;surface permanent magnet synchronous machine;electric motorization;land vehicles;electrical machines;torque characteristics;high saturation level;flux weakening;speed range;optimal acoustic modeling;electromechanical modeling;standard analytical modeling;finite element modeling;FEM;acoustic measurement","","2","","16","","","","","IEEE","IEEE Conferences"
"Statistical and Continuous Wavelet Analysis of wind speed data in Mardin-Turkey","E. Guseinoviene; A. Senulis; S. Seker; T. C. Akinci","Department of Electrical Engineering, Klaipeda University, Lithuania; Department of Electrical Engineering, Klaipeda University, Lithuania; Department of Electrical Engineering, Istanbul Technical University, Turkey; Dep. of Elec. &amp; Electronics Eng., Kirklareli University, Turkey","2014 Ninth International Conference on Ecological Vehicles and Renewable Energies (EVER)","","2014","","","1","5","In this paper, wind speed measurements are considered for Mardin region in Turkey. Mardin city is situated in East part of Turkey. Mardin is a mountainous area suitable for wind. And also, its wind energy potential is at an acceptable level. Wind speed data in this study, is obtained from the national meteorology station. This real-time measured data is suitable to international criteria. This annual data is related to the measurements of 2011, from January 1, 2011 to December 31, 2011. There are two important aspects of the study. First one is related to calculation of the statistical parameters for wind speed data. Here four parameters of a statistical distribution are calculated. These are mean value, standard deviation, skewness and kurtosis. Last two parameters are used to determine the non-Gaussian (or Gaussian) characteristics. In this study, the skewness and kurtosis parameters are are calculated and compared. Parameters indicate asymmetrical and non-Gaussian characteristics. Hence the wind speed distribution is defined by Weibull distribution and its probability density function is shown for shape parameter and average speed of the wind. Thus the histogram and Weibull probability density function are calculated as well as the statistical findings. As a second aspect of the study, data is accepted as non-stationary. So its Continuous Wavelet Transform is used for the determination of the seasonal transitions and determined the time-frequency content. Thanks to the continuous wavelet transform, low and high frequency regions of wind speed data are distinguished. Continuous wavelet transform findings are quite satisfactory.","","978-1-4799-3787-5978-1-4799-3786","10.1109/EVER.2014.6844073","","https://ieeexplore.ieee.org/stamp/stamp.jsp?arnumber=6844073","wind speed data;weibull distribution;continuous wavelet transform","Wind speed;Continuous wavelet transforms;Weibull distribution;Wind energy;Time-frequency analysis","wavelet transforms;Weibull distribution;wind;wind power","statistical analysis;continuous wavelet analysis;wind speed data;Turkey;Mardin city;national meteorology station;nonGaussian characteristic;skewness parameter;kurtosis parameter;wind speed distribution;Weibull distribution;probability density function;continuous wavelet transform","","1","","43","","","","","IEEE","IEEE Conferences"
"System of power supply and oscillating pulse current synchronous drive in power network","V. Jankūnas; A. Senulis; E. Guseinovienė; S. Seker; T. C. Akinci","Klaipeda University, Bijūnų str. 17, LT-91225 Klaipėda, Lithuania; Klaipeda University, Bijūnų str. 17, LT-91225 Klaipėda, Lithuania; Klaipeda University, Bijūnų str. 17, LT-91225 Klaipėda, Lithuania; Istanbul Technical University, Maslak, 34469, Turkey; Kirklareli University, Karahidir Campuss, 39100, Turkey","2014 Ninth International Conference on Ecological Vehicles and Renewable Energies (EVER)","","2014","","","1","7","There are a number of electrical drives with oscillatory driven mechanisms. As a result it is possible to use oscillating movement electrical drives there. These drives create ineligible reactive power, therefore it is required to provide conductors with the bigger cross-section, to design reactive energy storage devices. Reactive power is objectionable in electrical power network. Thus, in order to ensure the best work of oscillating drive the necessity for searching of reactive power reduction or its use methods occurs. The aim of the research is to examine pulsed power supply and oscillating movement pulse current synchronous drive system, in order to minimize the reactive power usage from power supply network and increase drive efficiency. To achieve this purpose pulse power supply and oscillating movement drive system mathematical model was designed, the influence of selected pulsed power supply to oscillating movement, drive performance indicators was determined as well.","","978-1-4799-3787-5978-1-4799-3786","10.1109/EVER.2014.6844066","","https://ieeexplore.ieee.org/stamp/stamp.jsp?arnumber=6844066","special electrical machines;oscillating drive;pulse power supply;reactive energy;power factor","Windings;Power supplies;Mathematical model;Reactive power;Resistance;Optical switches;Springs","electric drives;equivalent circuits;network analysis;oscillations;pulsed power supplies;reactive power;synchronous motor drives","oscillatory driven mechanisms;oscillating movement electrical drives;reactive energy storage devices;electrical power network;reactive power reduction;pulsed power supply;oscillating movement pulse current synchronous drive system;reactive power usage;power supply network;pulse power supply mathematical model;oscillating movement drive system mathematical model;drive performance indicators","","","","19","","","","","IEEE","IEEE Conferences"
"Current sensor fault diagnosis in the stationary frame for PMSM drive in automotive systems","S. Diao; Z. Makni; J. Bisson; D. Diallo; C. Marchand","Valeo/Group Electronics Expertise and Development, Services; 2 rue André Boulle, 94000, Créteil France; Valeo/Group Electronics Expertise and Development, Services; 2 rue André Boulle, 94000, Créteil France; Valeo/Group Electronics Expertise and Development, Services; 2 rue André Boulle, 94000, Créteil France; Laboratoire de Génie Electrique de Paris CNRS, Univ. Paris-Sud, Supélec, UPMC; 11 rue Joliot Curie, Plateau du Moulon, 91192 Gif-Sur-Yvette, France; Laboratoire de Génie Electrique de Paris CNRS, Univ. Paris-Sud, Supélec, UPMC; 11 rue Joliot Curie, Plateau du Moulon, 91192 Gif-Sur-Yvette, France","2014 Ninth International Conference on Ecological Vehicles and Renewable Energies (EVER)","","2014","","","1","7","This paper describes a method to diagnose current sensor fault in a Permanent Magnet Synchronous Machine (PMSM) drive for automotive applications. The method is based on a differential algebraic estimation of the faults dynamics in the stationary reference frame. The method is presented and analysed under the assumption of a single sensor fault (offset or gain). Simulation and experimental results show the effectiveness of the proposed approach.","","978-1-4799-3787-5978-1-4799-3786","10.1109/EVER.2014.6844143","","https://ieeexplore.ieee.org/stamp/stamp.jsp?arnumber=6844143","Fault diagnosis;current sensor;PMSM;electric vehicle;differential algebraic fault estimation","Estimation;Circuit faults;Fault detection;Current measurement;Mathematical model;Fault diagnosis;Computational modeling","automobiles;differential algebraic equations;electric sensing devices;fault diagnosis;permanent magnet motors;synchronous motor drives","current sensor fault diagnosis;PMSM drive;automotive systems;permanent magnet synchronous machine drive;differential algebraic estimation;stationary reference frame;faults dynamics","","3","","18","","","","","IEEE","IEEE Conferences"
"Discrete event diagnosis of environment impacts","C. Ciufudean; C. Filote","Stefan cel Mare University, 13 University str., Suceava, 720229, Romania; Stefan cel Mare University, 13 University str., Suceava, 720229, Romania","2014 Ninth International Conference on Ecological Vehicles and Renewable Energies (EVER)","","2014","","","1","7","This paper is focused on the improvement of the automated environment impact diagnosis on human health. Our approach is based on environmental features (EF) selection and classification, as we know that ecologic features represent patterns of important information. We assume that diagnostic, i.e. medical one, can be improved if the pattern is comprised by most of the significant environmental features. In our study, common sequence measures were employed to determine the saliency of a wide range of applications in the area of ecology, computational biology, as well as string editing, pattern recognition, etc. We assume that an important common sequence salience measure is to find the longest common subsequence for a set of n sequences. In order to perform this hard task, we use discrete event formalism, respectively Petri nets and we propose an algorithm for reducing the size of the digraphs. An interesting application to the ECG signals measured on five patients who leave in a polluted area of Romania will demonstrate that salient input features effectively aid the medical diagnosis process.","","978-1-4799-3787-5978-1-4799-3786","10.1109/EVER.2014.6844141","","https://ieeexplore.ieee.org/stamp/stamp.jsp?arnumber=6844141","diagnosis;discrete event systems;Petri nets;longest common subsequences","Electrocardiography;Feature extraction;Firing;Standards;Polynomials;Random variables;Pollution measurement","discrete event systems;electrocardiography;environmental factors;medical signal processing;patient diagnosis;pattern recognition;Petri nets;signal classification","discrete event diagnosis;automated environment impact diagnosis;human health;environmental features selection;environmental features classification;ecologic features;computational biology;string editing;pattern recognition;sequence salience measure;discrete event formalism;Petri nets;digraphs;ECG signals;polluted area;Romania;salient input features;medical diagnosis process","","","","38","","","","","IEEE","IEEE Conferences"
"An innovative environmentally-friendly full-electric drive solution for the actuation of shipboard loads: Analysis based on prototype testing results","C. Bruzzese; A. Tessarolo; L. Piva","Dept. of Astronautical, Electrical and Energy Engineering-DIAEE, University of Rome “La Sapienza”, Via Eudossiana 18, 00184, Italy; Dept. of Engineering and Architecture-DEA, University of Trieste, Via Valerio 10, 34127, Italy; General Directorate of Naval Armaments, NAVARM, Italian Ministry of Defence, Piazza della Marina 1,00196 Rome, Italy","2014 Ninth International Conference on Ecological Vehicles and Renewable Energies (EVER)","","2014","","","1","7","This paper analyzes a different approach for actuation of shipboard loads such as rudders, stabilizing fins, or other linear drives, which are usually powered by oil-fed actuators. Hydrostatic transmissions are classically used when the highest torques/forces with low speeds are demanded. However, the oil used as force-transmission fluid is troublesome due to environmental issues. Oil production, use, and final disposal is costly and presents environmental risks. Also the maintenance onboard ship is intensive and hazardous for the operators. A full electric solutions is ulteriorly studied in this paper, based on a prototyped linear machine using permanent magnets and inverter feeding. Copper, friction, and iron losses are the main limiting factors in developing the required thrust at low speed, which is, ultimately, the main obstacle to a gear-less or direct-drive full-electric application. This paper shows incremental work on the prototype, through a dedicated circuit model accounting for all the machine losses and providing an affordable model of machine overall efficiency. The model will be used in further works to asses the machine performances in typical onboard service duties.","","978-1-4799-3787-5978-1-4799-3786","10.1109/EVER.2014.6844023","","https://ieeexplore.ieee.org/stamp/stamp.jsp?arnumber=6844023","Direct drives;efficiency;environment;fins;hydraulics;linear drives;permanent magnets;rudders;ship","","electric drives;linear machines;permanent magnets","shipboard loads;prototype testing;rudders;stabilizing fins;linear drives;oil-fed actuators;hydrostatic transmissions;force-transmission fluid;full electric drive solution;linear machine;permanent magnets;inverter feeding;limiting factors;gear-less;direct-drive full-electric application","","7","","12","","","","","IEEE","IEEE Conferences"
"An algorithm for the estimation of the Maximum Power Voltages in microconverters based PV applications","M. Balato; M. Vitelli","Department of Industrial and Information Engineering-Second University of Naples, DIII-SUN, Aversa (CE)-Italy; Department of Industrial and Information Engineering-Second University of Naples, DIII-SUN, Aversa (CE)-Italy","2014 Ninth International Conference on Ecological Vehicles and Renewable Energies (EVER)","","2014","","","1","11","In order to extract the maximum energy from PhotoVoltaic (PV) systems operating under mismatching conditions, the adoption of a Hybrid Maximum Power Point Tracking (HMPPT) technique is necessary. Such a technique is based on the coupled use of two control techniques. The first one is a MPPT technique which is distributed on all the PV modules of the field and which properly regulates the operating voltage of each PV module. It is called Distributed Maximum Power Point Tracking (DMPPT) technique because it is carried out by means of suitable DC/DC converters (microconverters) which are distributed on all the PV modules of the array. The second control technique is called Central Maximum Power Point Tracking (CMPPT) technique because it is carried out by the central inverter which properly regulates the operating voltage of the whole PV array. The adoption of a HMPPT technique is necessary because, in order to extract the maximum available energy from a PV system operating in mismatching conditions, the proper regulation either of the PV modules voltages or of the DC inverter input voltage is necessary. One possible HMPPT technique adopts a Perturb & Observe (P&O) based DMPPT technique and a CMPPT technique which is based on the periodic sweep of the power versus voltage characteristic at the input of the inverter. Such a HMPPT technique is characterised by two major drawbacks: the waste of available energy during the sweep and the relatively low tracking speed. In this paper a new algorithm, called Fast Estimate of the Maximum Power Voltages (FEMPV), which can be profitably used in HMPPT applications in order to overcome the above drawbacks will be discussed. The case of microconverters based on the adoption of the buck, boost and buck-boost topology will be studied in detail.","","978-1-4799-3787-5978-1-4799-3786","10.1109/EVER.2014.6844109","","https://ieeexplore.ieee.org/stamp/stamp.jsp?arnumber=6844109","Maximum Power Point Tracking (MPPT);Hybrid MPPT (HMPPT);mismatching;grid connected PV systems","Vehicles;Voltage control;Inverters;Switches","invertors;maximum power point trackers;photovoltaic power systems","microconverters based PV applications;photovoltaic systems;mismatching conditions;hybrid maximum power point tracking technique;PV modules;operating voltage;distributed maximum power point tracking technique;DC/DC converters;central maximum power point tracking technique;central inverter;PV array;DC inverter input voltage;perturb & observe based DMPPT technique;CMPPT technique;fast estimate of the maximum power voltages;FEMPV;buck-boost topology","","1","","18","","","","","IEEE","IEEE Conferences"
"Life cycle cost analysis of data center project","M. Wiboonrat","College of Graduate Study in Management, Khon Kaen University, Bangkok Campus, Thailand","2014 Ninth International Conference on Ecological Vehicles and Renewable Energies (EVER)","","2014","","","1","6","The reexamining the feasibility and cost impact of sustainable data center design is in the light of increased market adoption. Life cycle cost analysis (LCCA) of data centers is a system approach for appraising and predicting the total cost of facility ownership. It must be taken into account all costs of feasible, estimating, acquiring, operating, maintaining, and disposing of data center ecosystem. This research classified LCCA of data center into four phases: planning, implementing, operating, and transforming. The qualitative research was conducted through investigating triangulation, interviews, focus groups and case studies. Data center's consultants, system integrators, and project owners are the focus groups for in-depth interviews. The research findings propose data center cost capsule (DCCC) model which identifies all associated costs of entire data center life cycle; before, during, and after operations. The DCCC model is designed to comply with international standards e.g., ISO 9001: 2008 and TIA 942. Moreover, the DCCC model foresees the total costs of ownership of data center.","","978-1-4799-3787-5978-1-4799-3786","10.1109/EVER.2014.6844139","","https://ieeexplore.ieee.org/stamp/stamp.jsp?arnumber=6844139","data center;life cycle cost analysis;total cost of ownership;data center cost capsule model","Standards;Buildings;Cost benefit analysis;Data models;Project management;Analytical models","computer centres;ISO standards;life cycle costing","TIA 942;ISO 9001:2008;international standard;DCCC model;data center cost capsule;data center ecosystem;facility ownership;LCCA;sustainable data center design;life cycle cost analysis","","1","","20","","","","","IEEE","IEEE Conferences"
