"Photometric laser scanner to camera calibration for low resolution sensors","J. Gräter; T. Strauss; M. Lauer","Department of Measurement and Control, Karlsruhe Institute of Technology, Germany; Department of Measurement and Control, Karlsruhe Institute of Technology, Germany; Department of Measurement and Control, Karlsruhe Institute of Technology, Germany","2016 IEEE 19th International Conference on Intelligent Transportation Systems (ITSC)","","2016","","","1552","1557","In modern automated systems the usage of sensors with orthogonal measurement principles is indispensable for assuring a redundant system. The combination of laser scanners and cameras is particularly prevalent. To profit from the potential of fusing information from these sensors, the basic step is sensor registration. State of the art cross-calibration methods for laser scanners and cameras establish geometric correspondences for example by detecting checker-boards in size and form. However these approaches suffer from ambivalent features and are only usable if the laser scanner has a high scanning density. Therefore, we present a reconstruction-free and vision-based extrinsic calibration algorithm with distinct features, which was developed with special focus on low-density laser scanners and high measurement noise. Moreover, we contribute an evaluation methodology demonstrating the capability of our approach. Along with this paper, we publish the associated code.","2153-0017","978-1-5090-1889-5978-1-5090-1888-8978-1-5090-1890","10.1109/ITSC.2016.7795764","","https://ieeexplore.ieee.org/stamp/stamp.jsp?arnumber=7795764","","Cameras;Measurement by laser beam;Calibration;Sensors;Feature extraction;Laser modes","calibration;cameras;image fusion;image registration;image resolution;image scanners;image sensors;optical scanners;photometry","photometric laser scanner;camera calibration;low resolution sensor registration;automated system;orthogonal measurement principle;redundant system;information fusion;cross-calibration method;checker-board detection;reconstruction-free vision-based extrinsic calibration algorithm;low density laser scanner;measurement noise","","2","","13","","","","","IEEE","IEEE Conferences"
"Satisfiability verification of engineering data safety rules of balise based on ROBDD","Tongdian Wang; Huibing Zhao; Linfu Zhu","State Key Laboratory of Rail Traffic Control and Safety, Beijing Jiaotong University, China; NA; NA","2016 IEEE 19th International Conference on Intelligent Transportation Systems (ITSC)","","2016","","","2386","2391","Engineering data safety pervades the balise telegram compilation, which affects the railway traffic safety. The existing method to ensure data safety is to verify that whether the data conform to the specific verification rules generated based on the balise application principles and engineering data compilation specifications. However, these rules are described by natural language, which are characterized by ambiguity and scarcity. The situation often arises where insufficient verifications of engineering data may lead to data safety problems in most cases. To address this problem above, implicit logic rules are explored ground on the constraints between every pair of data, and modelled as a Boolean function firstly. Then, the Reduced Ordered Binary Decision Diagram (ROBDD) construction and depth-first searching algorithm are performed to verify the satisfiability of the rules. Compared with the original ones, the extracted authenticated logic rules have promising results in the accuracy of data checking, and can further improve the safety of engineering data.","2153-0017","978-1-5090-1889-5978-1-5090-1888-8978-1-5090-1890","10.1109/ITSC.2016.7795940","","https://ieeexplore.ieee.org/stamp/stamp.jsp?arnumber=7795940","engineering data;data safety;implicit relation;ROBDD;satisfiability verification","Boolean functions;Data structures;Rail transportation;Hazards;Data models;Data mining","binary decision diagrams;Boolean functions;computability;formal verification;natural languages;rail traffic;railway safety;security of data","data checking;ROBDD;reduced ordered binary decision diagram;Boolean function;logic rules;natural language;verification rules;railway traffic safety;balise telegram compilation;engineering data safety rules;satisfiability verification","","","","16","","","","","IEEE","IEEE Conferences"
"On the validation of an electric bus simulation model through sensitivity analysis","D. Perrotta; R. J. F. Rossetti; J. L. Afonso","Laboratório de Inteligência Artificial e Ciência de Computadores, Departamento de Engenharia Informática, Faculdade de Engenharia da Universidade do Porto, Portugal; Laboratório de Inteligência Artificial e Ciência de Computadores, Departamento de Engenharia Informática, Faculdade de Engenharia da Universidade do Porto, Portugal; Centro Algoritmi, Universidade do Minho, Portugal","2016 IEEE 19th International Conference on Intelligent Transportation Systems (ITSC)","","2016","","","342","347","In the contemporary world, simulation has been gaining a huge importance due to the cost reduction it promotes on many different areas. This paper proposes a validation methodology for the simulation model of an electric bus. This methodology consists in applying the sensitivity analysis method to assess the robustness of the model, compared to real data collected for different scenarios. Data were collected from the operation of the real bus and used in the validation process, which could demonstrate that the model's outcomes are valid within a range of changes in the parameters analyzed, namely number of passengers and accessories energy consumption.","2153-0017","978-1-5090-1889-5978-1-5090-1888-8978-1-5090-1890","10.1109/ITSC.2016.7795577","","https://ieeexplore.ieee.org/stamp/stamp.jsp?arnumber=7795577","","Mathematical model;Computational modeling;Data models;Sensitivity analysis;Analytical models;Energy consumption;Transportation","cost reduction;electric vehicles;power engineering computing;sensitivity analysis;simulation","electric bus simulation model;sensitivity analysis;cost reduction;validation methodology","","","","15","","","","","IEEE","IEEE Conferences"
"High-speed highway scene prediction based on driver models learned from demonstrations","D. S. González; J. S. Dibangoye; C. Laugier","INRIA Grenoble Rhone-Alpes, 38330 Montbonnot-Saint-Martin, France; INRIA Grenoble Rhone-Alpes, 38330 Montbonnot-Saint-Martin, France; INRIA Grenoble Rhone-Alpes, 38330 Montbonnot-Saint-Martin, France","2016 IEEE 19th International Conference on Intelligent Transportation Systems (ITSC)","","2016","","","149","155","One of the key factors to ensure the safe operation of autonomous and semi-autonomous vehicles in dynamic environments is the ability to accurately predict the motion of the dynamic obstacles in the scene. In this work, we show how to use a realistic driver model learned from demonstrations via Inverse Reinforcement Learning to predict the long-term evolution of highway traffic scenes. We model each traffic participant as a Markov Decision Process in which the cost function is a linear combination of static and dynamic features. In particular, the static features capture the preferences of the driver while the dynamic features, which change over time depending on the actions of the other traffic participants, capture the driver's risk-aversive behavior. Using such a model for prediction enables us to explicitly consider the interactions between traffic participants while keeping the computational complexity quadratic in the number of vehicles in the scene. Preliminary experiments in simulated and real scenarios show the capability of our approach to produce reliable, human-like scene predictions.","2153-0017","978-1-5090-1889-5978-1-5090-1888-8978-1-5090-1890","10.1109/ITSC.2016.7795546","","https://ieeexplore.ieee.org/stamp/stamp.jsp?arnumber=7795546","","Vehicles;Cost function;Vehicle dynamics;Road transportation;Predictive models;Trajectory;Dynamics","computational complexity;decision theory;inverse problems;learning (artificial intelligence);Long Term Evolution;Markov processes;motion measurement;prediction theory;road safety;road traffic;road vehicles","high-speed highway traffic scene prediction;semiautonomous vehicle;autonomous vehicle;dynamic obstacle motion prediction;realistic driver model;inverse reinforcement learning;Long-Term Evolution;Markov decision process;risk-aversive behavior;computational complexity;human-like scene prediction","","4","","16","","","","","IEEE","IEEE Conferences"
"An exploratory study of taxi sharing schemas","E. Silva; Z. Kokkinogenis; Á. Câmara; J. Ulisses; J. Urbano; D. C. Silva; E. Oliveira; R. J. F. Rossetti","Artificial Intelligence and Computer Science Laboratory (LIACC), Faculty of Engineering, University of Porto, Rua Dr. Roberto Frias, s/n, 4200-465, Portugal; Artificial Intelligence and Computer Science Laboratory (LIACC), Faculty of Engineering, University of Porto, Rua Dr. Roberto Frias, s/n, 4200-465, Portugal; Artificial Intelligence and Computer Science Laboratory (LIACC), Faculty of Engineering, University of Porto, Rua Dr. Roberto Frias, s/n, 4200-465, Portugal; Artificial Intelligence and Computer Science Laboratory (LIACC), Faculty of Engineering, University of Porto, Rua Dr. Roberto Frias, s/n, 4200-465, Portugal; Artificial Intelligence and Computer Science Laboratory (LIACC), Faculty of Engineering, University of Porto, Rua Dr. Roberto Frias, s/n, 4200-465, Portugal; Artificial Intelligence and Computer Science Laboratory (LIACC), Faculty of Engineering, University of Porto, Rua Dr. Roberto Frias, s/n, 4200-465, Portugal; Artificial Intelligence and Computer Science Laboratory (LIACC), Faculty of Engineering, University of Porto, Rua Dr. Roberto Frias, s/n, 4200-465, Portugal; Artificial Intelligence and Computer Science Laboratory (LIACC), Faculty of Engineering, University of Porto, Rua Dr. Roberto Frias, s/n, 4200-465, Portugal","2016 IEEE 19th International Conference on Intelligent Transportation Systems (ITSC)","","2016","","","247","252","Taxi sharing services have been increasing in the past few years in several countries. In this paper we propose a solution to taxi sharing problem based on Vehicle Routing Problem (VRP) with Temporal Restriction. We approach the problem in a static way, for testing purposes. Two metaheuristics were used to determine the best travel plans for taxi sharing service, taking into account the pickup and delivery time of each passenger. Tabu Search (TS) and Simulated Annealing (SA) were used to solve the problem, as literature review suggested, presenting good results. Four test scenario were used with 10, 20, 30 and 40 passengers, knowing their starting location. Analysis of solutions found by TS and SA are compared to the average cost to conclude which is the best travel plan to be used by taxi sharing service.","2153-0017","978-1-5090-1889-5978-1-5090-1888-8978-1-5090-1890","10.1109/ITSC.2016.7795562","","https://ieeexplore.ieee.org/stamp/stamp.jsp?arnumber=7795562","","Public transportation;Vehicles;Simulated annealing;Planning;Vehicle routing;Search problems;Vehicle dynamics","search problems;simulated annealing;vehicle routing","taxi sharing schemas;vehicle routing problem;VRP;metaheuristics;tabu search;TS;simulated annealing;SA","","3","","23","","","","","IEEE","IEEE Conferences"
"Cooperative content offloading through WiFi and mobile device-to-device networks","Guoqiang Mao; Xiaofeng Tao","School of Computing and Communications, The University of Technology Sydney, Australia; National Engineering Lab. for Mobile Network Security, Beijing, University of Posts and Telecommunications, China","2016 IEEE 19th International Conference on Intelligent Transportation Systems (ITSC)","","2016","","","2022","2028","This paper investigates the use of WiFi and mobile device-to-device networks, with vehicular ad hoc networks being a typical example, as a complementary means to offload and reduce the traffic load of cellular networks. A novel cooperative content dissemination strategy is proposed for a heterogeneous network consisting of different types of devices with different levels of mobility, ranging from static WiFi access points to mobile devices such as vehicles. The proposed strategy offloads a significant proportion of data traffic from cellular networks to WiFi or device-to-device networks. Detailed analysis is provided for the content dissemination process in heterogeneous networks adopting the strategy. On that basis, the optimal parameter settings for the content dissemination strategy are discussed. Simulation and numerical studies show that the proposed strategy effectively reduces data traffic for cellular networks while guaranteeing successful content delivery.","2153-0017","978-1-5090-1889-5978-1-5090-1888-8978-1-5090-1890","10.1109/ITSC.2016.7795883","","https://ieeexplore.ieee.org/stamp/stamp.jsp?arnumber=7795883","","IEEE 802.11 Standard;Cellular networks;Mobile handsets;Ad hoc networks;Mobile computing;Encoding","cellular radio;cooperative communication;mobile handsets;telecommunication traffic;vehicular ad hoc networks;wireless LAN","cooperative content offloading;mobile device-to-device network;vehicular ad hoc network;cellular network;cooperative content dissemination strategy;heterogeneous network;static WiFi access point;data traffic load;content dissemination process","","","","22","","","","","IEEE","IEEE Conferences"
"A multi-agent planning model for airport ground handling management","P. C. Kabongo; T. M. F. Ramos; A. F. Leite; C. G. Ralha; L. Weigang","Department of Computer Science at the University of Brasilia, C.P. 4466, Brasília-DF, CEP: 70910-900, Brazil; Department of Computer Science at the University of Brasilia, C.P. 4466, Brasília-DF, CEP: 70910-900, Brazil; Department of Computer Science at the University of Brasilia, C.P. 4466, Brasília-DF, CEP: 70910-900, Brazil; Department of Computer Science at the University of Brasilia, C.P. 4466, Brasília-DF, CEP: 70910-900, Brazil; Department of Computer Science at the University of Brasilia, C.P. 4466, Brasília-DF, CEP: 70910-900, Brazil","2016 IEEE 19th International Conference on Intelligent Transportation Systems (ITSC)","","2016","","","2354","2359","Inefficiency airport ground handing operations is one of the main reasons for flight delays, as it comprises a series of processes and collaborations between various airport's services. Using multi-agent planning (MAP) method, this paper proposes a framework as a management system to improve the airport ground handling management (GHM). With the identification of the services and resources related to GHM, the forward MAP approach is applied to coordinates the tasks and planning in order to reduce both the delays and the operating cost. In this case, the key contribution includes MAP model for airport ground handling operations under a unified framework compatible with the airport collaborative decision making (ACDM) strategy.","2153-0017","978-1-5090-1889-5978-1-5090-1888-8978-1-5090-1890","10.1109/ITSC.2016.7795935","","https://ieeexplore.ieee.org/stamp/stamp.jsp?arnumber=7795935","Multi-Agent Planning;Airport Collaborative Decision Making;Airport Ground Handling Management","Planning;Airports;Atmospheric modeling;Delays;Aircraft;Scheduling;Collaboration","airports;decision making;multi-agent systems","multiagent planning model;airport ground handling management;MAP method;GHM;airport collaborative decision making strategy;ACDM strategy","","1","","20","","","","","IEEE","IEEE Conferences"
"Enriching a spatial road representation with lanes and driving directions","E. Casapietra; T. H. Weisswange; C. Goerick; F. Kummert","NA; NA; NA; NA","2016 IEEE 19th International Conference on Intelligent Transportation Systems (ITSC)","","2016","","","1579","1585","The detection of lane layout in the surroundings of the ego-vehicle is a key issue for modern ADAS and autonomous driving. Most modern systems rely on annotated spatial maps to provide lane information. However, these maps are not available everywhere, and thus have to be often supported by direct detection systems (e.g. cameras, lasers). Such systems detect lane boundaries by directly observing lane markings or sensing curbstones and pavements. However, well defined boundaries are not always there, or they can be difficult to detect, especially in rural or inner city roads. Furthermore, other traffic participants in the surroundings can significantly limit the field of view of the ego-vehicle. In order to help lane detection in this kind of scenario, indirect cues, such as the behavior of the other vehicles, can be a useful resource. In this paper we propose a grid-based approach, that works on a road terrain representation and assigns a lane and a driving direction to each patch of road. Our approach segments the road terrain into multiple lanes based on geometrical considerations and prior knowledge, and then assigns a driving direction to each lane, taking into account the observed and predicted motion of the other vehicles in the scene. The road terrain is provided by a system we proposed in a previous work, which combines direct and indirect cues to build a probabilistic road representation grid. This new approach constitutes an additional layer to our representation, providing more awareness about the road regulations to motion control systems and allowing them to plan safer trajectories.","2153-0017","978-1-5090-1889-5978-1-5090-1888-8978-1-5090-1890","10.1109/ITSC.2016.7795768","","https://ieeexplore.ieee.org/stamp/stamp.jsp?arnumber=7795768","","Roads;Vehicles;Sensors;Layout;Trajectory;Probabilistic logic;Radar","geotechnical engineering;probability;road safety;roads","motion control system;probability;grid-based approach;curbstone sensing;pavement sensing;ADAS;lane layout detection;spatial road terrain representation","","1","","16","","","","","IEEE","IEEE Conferences"
"Two-camera based accurate vehicle speed measurement using average speed at a fixed point","D. F. Llorca; C. Salinas; M. Jiménez; I. Parra; A. G. Morcillo; R. Izquierdo; J. Lorenzo; M. A. Sotelo","Computer Engineering Department, Polytechnic School, University of Alcalá, Madrid, Spain; Computer Engineering Department, Polytechnic School, University of Alcalá, Madrid, Spain; Computer Engineering Department, Polytechnic School, University of Alcalá, Madrid, Spain; Computer Engineering Department, Polytechnic School, University of Alcalá, Madrid, Spain; Computer Engineering Department, Polytechnic School, University of Alcalá, Madrid, Spain; Computer Engineering Department, Polytechnic School, University of Alcalá, Madrid, Spain; Computer Engineering Department, Polytechnic School, University of Alcalá, Madrid, Spain; Computer Engineering Department, Polytechnic School, University of Alcalá, Madrid, Spain","2016 IEEE 19th International Conference on Intelligent Transportation Systems (ITSC)","","2016","","","2533","2538","In this paper we present a novel two-camera-based accurate vehicle speed detection system. Two high-resolution cameras, with high-speed and narrow field of view, are mounted on a fixed pole. Using different focal lengths and orientations, each camera points to a different stretch of the road. Unlike standard average speed cameras, where the cameras are separated by several kilometers and the errors in measurement of distance can be in the order of several meters, our approach deals with a short stretch of a few meters, which involves a challenging scenario where distance estimation errors should be in the order of centimeters. The relative distance of the vehicles w.r.t. the cameras is computed using the license plate as a known reference. We demonstrate that there is a specific geometry between the cameras that minimizes the speed error. The system was tested on a real scenario using a vehicle equipped with DGPS to compute ground truth speed values. The obtained results validate the proposal with maximum speed errors <; 3kmh at speeds up to 80kmh.","2153-0017","978-1-5090-1889-5978-1-5090-1888-8978-1-5090-1890","10.1109/ITSC.2016.7795963","","https://ieeexplore.ieee.org/stamp/stamp.jsp?arnumber=7795963","Vehicle speed measurement;average speed;range error;speed error;license plate","Cameras;Vehicles;Licenses;Roads;Velocity measurement;Sensors;Global Positioning System","cameras;road vehicles;signal processing equipment;velocity measurement","two-camera based accurate vehicle speed measurement;average speed;high resolution camera;distance estimation error;ground truth speed","","4","","27","","","","","IEEE","IEEE Conferences"
"An exact approach for the container retrieval problem to reduce crane's trajectory","A. d. S. Firmino; R. M. de Abreu Silva; V. C. Times","Center for Informatics, Federal University of Pernambuco, 50740-560, Recife, Brazil; Center for Informatics, Federal University of Pernambuco, 50740-560, Recife, Brazil; Center for Informatics, Federal University of Pernambuco, 50740-560, Recife, Brazil","2016 IEEE 19th International Conference on Intelligent Transportation Systems (ITSC)","","2016","","","933","938","The container retrieval problem (CRP) is an important issue to achieve high yard operational efficiency in a container terminal system. The CRP aims to find an optimal sequence of operations for the crane to retrieve all the containers from the bay according to a predefined order. An optimal sequence of operations is obtained by either reducing the number of container relocations or reducing the total travel distance performed by the crane, i.e., crane's trajectory. In contrast to previous studies discussed in the literature, in this study, the optimization goal is to minimize the trajectory undertaken by crane. In this regard, this paper proposes two exact optimization algorithms based on Dijkstra's algorithm and A* search algorithm frameworks. The latter includes proposal of an intelligent strategy to explore the most promising nodes in the search tree. The experimental results show that the proposed algorithms achieve an optimal solution in a shorter computation time when applied to realistic scenarios.","2153-0017","978-1-5090-1889-5978-1-5090-1888-8978-1-5090-1890","10.1109/ITSC.2016.7795667","","https://ieeexplore.ieee.org/stamp/stamp.jsp?arnumber=7795667","","Containers;Cranes;Optimization;Heuristic algorithms;Trajectory;Marine vehicles;Algorithm design and analysis","cranes;operations research;sea ports;search problems","container retrieval problem;crane trajectory;container terminal system operational efficiency;operation optimal sequence;trajectory minimisation;exact optimization algorithms;Dijkstra algorithm;A* search algorithm","","2","","26","","","","","IEEE","IEEE Conferences"
"Supporting road maintenance with in-vehicle data: Results from a field trial on road surface condition monitoring","R. Brunauer; K. Rehrl","Salzburg Research Forschungsgesellschaft m.b.H., Jakob-Haringer-Stra&#x00DF;e 5, 5020, Austria; Salzburg Research Forschungsgesellschaft m.b.H., Jakob-Haringer-Stra&#x00DF;e 5, 5020, Austria","2016 IEEE 19th International Conference on Intelligent Transportation Systems (ITSC)","","2016","","","2236","2241","For road operators, road surface condition monitoring is a costly but necessary task. Usually, road operators have to conduct time-consuming and therefore costly inspection drives with specialized sensor vehicles gathering high precision measurements. This raises the question whether vehicle-data collected during daily routine drives could replace or at least supplement inspection drives. In this paper we present a prototypical implementation of a road surface condition monitoring system which analyses the vertical acceleration signal from vehicle-mounted accelerometer sensors (physical jerks). The work proposes a linearly referenced road surface condition index (RSCI), being derived from position and accelerometer measurements and being capable of describing vehicle-sensed road surface quality. A road operator supported field trial - using a prototypical system for raw data collection, analysis and integration of the derived road surface condition information into the road operator's legacy systems - was conducted to collect sample data as well as field experiences and to learn about the benefits of such an approach from the perspective of road operators. Results clearly demonstrate that the derived road surface condition information (RSCI, heavy jerks) is able to supplement existing maintenance information and provides a valuable additional data source for road operators by helping to focus monitoring and maintenance tasks. Beside the general applicability, several challenges and refinements on the way to a fully operational system have been identified.","2153-0017","978-1-5090-1889-5978-1-5090-1888-8978-1-5090-1890","10.1109/ITSC.2016.7795917","","https://ieeexplore.ieee.org/stamp/stamp.jsp?arnumber=7795917","","Roads;Accelerometers;Vehicles;Inspection;Condition monitoring;Acceleration","acceleration measurement;accelerometers;condition monitoring;inspection;maintenance engineering;position measurement;sensors;surface topography measurement","road maintenance;vehicle-data collection;inspection;road surface condition monitoring system;vertical acceleration signal analysis;vehicle-mounted accelerometer sensor;linearly referenced road surface condition index;RSCI;accelerometer measurement;position measurement;vehicle-sensed road surface quality;data analysis","","","","22","","","","","IEEE","IEEE Conferences"
