"Optimal design of formation tracking control for a tractor-trailer robotic system with omni-directional wheels","N. Lashkari; M. Biglarbegian; S. X. Yang","School of Engineering, University of Guelph, Canada; School of Engineering, University of Guelph, Canada; School of Engineering, University of Guelph, Canada","2016 IEEE 19th International Conference on Intelligent Transportation Systems (ITSC)","","2016","","","1826","1831","This paper addresses the formation tracking control and optimal selection of control design parameters for a tractor-trailer omni-directional type robotic system with on-axle hitching. We design a sliding mode controller incorporating the dynamics of the system to drive the tractor robot to track a desired trajectory and the trailer robot to maintain a desired orientation with respect to the tractor. We also define an optimization problem to find the control design parameters that maximize the control performance and solve it using meta-heuristics optimization techniques. The stability of the developed controller is studied using Lyapunov theorem. We demonstrate the effectiveness of our proposed methodology using simulation results. It is concluded that the proposed control methodology can be adopted in real-time experiments and is applicable in real-world applications for good formation tracking performance under large disturbances.","2153-0017","978-1-5090-1889-5978-1-5090-1888-8978-1-5090-1890","10.1109/ITSC.2016.7795806","","https://ieeexplore.ieee.org/stamp/stamp.jsp?arnumber=7795806","","Mobile robots;Control design;Optimization;Robot kinematics;Agricultural machinery;Tracking","control system synthesis;mobile robots;optimisation;position control;transportation;variable structure systems;wheels","formation tracking control;tractor-trailer robotic system;omnidirectional wheels;control design parameters;on-axle hitching;sliding mode controller design;optimization problem;metaheuristics optimization techniques;tractor-trailer mobile robot","","2","","22","","","","","IEEE","IEEE Conferences"
"Interaction aware trajectory planning for merge scenarios in congested traffic situations","N. Evestedt; E. Ward; J. Folkesson; D. Axehill","Division of Automatic Control, Linköping University, Sweden; Computer Vision and Active Perception Lab, KTH, Stockholm, Sweden; Computer Vision and Active Perception Lab, KTH, Stockholm, Sweden; Division of Automatic Control, Linköping University, Sweden","2016 IEEE 19th International Conference on Intelligent Transportation Systems (ITSC)","","2016","","","465","472","In many traffic situations there are times where interaction with other drivers is necessary and unavoidable in order to safely progress towards an intended destination. This is especially true for merge manoeuvres into dense traffic, where drivers sometimes must be somewhat aggressive and show the intention of merging in order to interact with the other driver and make the driver open the gap needed to execute the manoeuvre safely. Many motion planning frameworks for autonomous vehicles adopt a reactive approach where simple models of other traffic participants are used and therefore need to adhere to large margins in order to behave safely. However, the large margins needed can sometimes get the system stuck in congested traffic where time gaps between vehicles are too small. In other situations, such as a highway merge, it can be significantly more dangerous to stop on the entrance ramp if the gaps are found to be too small than to make a slightly more aggressive manoeuvre and let the driver behind open the gap needed. To remedy this problem, this work uses the Intelligent Driver Model (IDM) to explicitly model the interaction of other drivers and evaluates the risk by their required deceleration in a similar manner as the Minimum Overall Breaking Induced by Lane change (MOBIL) model that has been used in large scale traffic simulations before. This allows the algorithm to evaluate the effect on other drivers depending on our own trajectory plans by simulating the nearby traffic situation. Finding a globally optimal solution is often intractable in these situations so instead a large set of candidate trajectories are generated that are evaluated against the traffic scene by forward simulations of other traffic participants. By discretization and using an efficient trajectory generator together with efficient modelling of the traffic scene real-time demands can be met.","2153-0017","978-1-5090-1889-5978-1-5090-1888-8978-1-5090-1890","10.1109/ITSC.2016.7795596","","https://ieeexplore.ieee.org/stamp/stamp.jsp?arnumber=7795596","","Trajectory;Vehicles;Planning;Acceleration;Predictive models;Roads;Merging","intelligent transportation systems;path planning;risk management;road traffic control;trajectory control","trajectory planning;merge scenario;traffic congestion;motion planning;intelligent driver model;IDM;driver interaction modelling;risk evaluation","","3","","11","","","","","IEEE","IEEE Conferences"
"P2V and V2P communication for Pedestrian warning on the basis of Autonomous Vehicles","A. Hussein; F. García; J. M. Armingol; C. Olaverri-Monreal","Intelligent Systems Lab (LSI) Research Group, Universidad Carlos III de Madrid, Spain; Intelligent Systems Lab (LSI) Research Group, Universidad Carlos III de Madrid, Spain; Intelligent Systems Lab (LSI) Research Group, Universidad Carlos III de Madrid, Spain; University of Applied Sciences Technikum Wien, Department of Information Engineering and Security, Vienna, Austria","2016 IEEE 19th International Conference on Intelligent Transportation Systems (ITSC)","","2016","","","2034","2039","The use of smartphones in a road context by drivers and Vulnerable Road Users (VRU) is rapidly increasing. To reduce the risks related to the influence of smartphone usage in a situation where traffic needs to be considered, a collision prediction algorithm is proposed based on Pedestrian to Vehicle (P2V) and Vehicle to Pedestrian (V2P) communication technologies, which increases the visual situational awareness of VRU regarding the nearby location of both autonomous and manually-controlled vehicles in a user-friendly form. The proposed application broadcasts the device's position to the vehicles nearby, and reciprocally, the vehicles nearby broadcast their position to the device in use, supporting pedestrians and other VRU to minimize potential dangers and increase the acceptance of autonomous vehicles on our roads. Results regarding the evaluation of the proposed approach showed a good performance and high detection rate, as well as a high user satisfaction derived from the interaction with the system.","2153-0017","978-1-5090-1889-5978-1-5090-1888-8978-1-5090-1890","10.1109/ITSC.2016.7795885","","https://ieeexplore.ieee.org/stamp/stamp.jsp?arnumber=7795885","","Roads;Autonomous vehicles;Prediction algorithms;Smart phones;Safety","pedestrians;road vehicles;smart phones;vehicular ad hoc networks","autonomous controlled vehicle;manually-controlled vehicle;visual situational awareness;vehicle to pedestrian communication technology;pedestrian to vehicle communication technology;collision prediction algorithm;VRU;vulnerable road user;smartphone;autonomous vehicle;pedestrian warning;V2P communication technology;P2V communication technology","","13","","31","","","","","IEEE","IEEE Conferences"
"An automated warehouse design validation using discrete simulation","R. Peixoto; L. Dias; M. S. Carvalho; G. Pereira; C. A. S. Geraldes","Brazilian Air Force, São Paulo, Brazil; Centro ALGORITMI and University of Minho, Braga, Portugal; Centro ALGORITMI and University of Minho, Braga, Portugal; Centro ALGORITMI and University of Minho, Braga, Portugal; Polytechnic Institute of Bragança, Portugal","2016 IEEE 19th International Conference on Intelligent Transportation Systems (ITSC)","","2016","","","199","204","In this paper we discuss the use of discrete simulation technique to support the redesign process of an automated warehouse system of the Brazilian Air Force unit. This unit is responsible for the supply of all uniform items and other military support material to their military forces. In particular, our work aims at analysing the inclusion of an automated sorting system to prepare uniforms individual kits in order to release downstream supply chain from this task. The main challenge was to investigate the impact on the existing storage system of a new sorting system and, simultaneously, to explore if additional management measures are required to satisfy both throughput levels and overall supply chain requirements. To accomplish a solution for such a complex problem simulation models were developed using ARENA software. Results have shown that the use of simulation allows not only the assessment of the impact of the new sorting equipment but also to test different warehouse management strategies that should be adopted concurrently to ensure that desired throughput levels can be achieved in the new scenario. In fact, this research illustrates the flexibility of the simulation tool to address several complex management issues simultaneously such as the introduction of picking sequencing rules, the use of a class-based storage policy, the addition of new picking stations, and an increase of the number of the available boxes used for transportation.","2153-0017","978-1-5090-1889-5978-1-5090-1888-8978-1-5090-1890","10.1109/ITSC.2016.7795554","","https://ieeexplore.ieee.org/stamp/stamp.jsp?arnumber=7795554","","Sorting;Atmospheric modeling;Military aircraft;Analytical models;Supply chains;Throughput","intelligent transportation systems;materials handling;warehouse automation","automated warehouse design validation;discrete simulation;ARENA software;automated sorting system","","1","","14","","","","","IEEE","IEEE Conferences"
"Virtual resource allocation in a network virtualization based integrated train ground communication system","Fei Wang; Li Zhu; Hongli Zhao","State Key Laboratory of Rail Traffic Control and Safety, Beijing Jiaotong University, China; State Key Laboratory of Rail Traffic Control and Safety, Beijing Jiaotong University, China; National Engineering Research Center of Rail Transportation Operation and Control System, Beijing Jiaotong University, China","2016 IEEE 19th International Conference on Intelligent Transportation Systems (ITSC)","","2016","","","2012","2016","Train ground communication systems for different applications are deployed and managed independently in current urban rail transit systems with Wireless Local Area Network (WLAN) technology. Investing and constructing communication infrastructures repeatedly not only waste substantial social resources but also bring many difficulties to maintain all these infrastructures. In this paper, we design a network virtualization based integrated train ground communication system for urban rail transit systems. The virtual resource allocation in the integrated system is formulated as an optimization problem. On the premise that the train ground communication requirement of communication based train control system is guaranteed, the optimization objective is to maximize the long-term general utility for all the urban rail transit applications. We use the distributed method based on alternating direction method of multipliers (ADMM) to solve the optimization problem. Simulation results show that the designed integrated train ground communication system quality of service (QoS) can be improved effectively with the proposed approach.","2153-0017","978-1-5090-1889-5978-1-5090-1888-8978-1-5090-1890","10.1109/ITSC.2016.7795881","","https://ieeexplore.ieee.org/stamp/stamp.jsp?arnumber=7795881","","Virtualization;Rails;Resource management;Wireless communication;Optimization;Quality of service","optimisation;railway communication;resource allocation;virtualisation;wireless LAN","virtual resource allocation;network virtualization based integrated train ground communication system;urban rail transit systems;wireless local area network atechnology;WLAN technology;communication infrastructures;optimization problem;communication based train control system;long-term general utility;alternating direction method of multipliers;ADMM;distributed method;quality of service;QoS","","","","14","","","","","IEEE","IEEE Conferences"
"A generic driving strategy for urban environments","C. Hubmann; M. Aeberhard; C. Stiller","BMW Research and Technology, Munich, Germany; BMW Research and Technology, Munich, Germany; Karlsruhe Institute of Technology (KIT), Institute for Control Theory, 76131, Germany","2016 IEEE 19th International Conference on Intelligent Transportation Systems (ITSC)","","2016","","","1010","1016","Autonomous driving in urban environments depends on the ability to interpret the current situation and to react accordingly. This means to continuously make decisions for certain comfort-optimized maneuvers under the constraints of traffic rules and feasibility. This work presents a novel, longitudinal driving strategy formulated as a discrete planning problem. Instead of designing an algorithm for a single one of various potential subproblems, two interfaces are presented, called static and dynamic events, that are capable of representing any situation along the chosen lane of the autonomous vehicle. This allows fast, analytic calculation of Inevitable Collision States which are used as heuristic to realize a guided A* search. Instead of being limited to a small, finite set of maneuvers as rule-based driving strategies like state machines are, the algorithm selects the optimal of an infinite number of possible, implicit maneuvers. The presented algorithm has a worst-case runtime of 80 ms for a planning horizon of 13 seconds and is therefore capable of running online. The approach is evaluated on a simulator in a complex city scenario and on a prototype vehicle on the test track.","2153-0017","978-1-5090-1889-5978-1-5090-1888-8978-1-5090-1890","10.1109/ITSC.2016.7795679","","https://ieeexplore.ieee.org/stamp/stamp.jsp?arnumber=7795679","","Trajectory;Urban areas;Vehicles;Planning;Heuristic algorithms;Automation;Road transportation","intelligent transportation systems;road traffic control","urban environments;autonomous driving;discrete planning problem;autonomous vehicle","","10","","29","","","","","IEEE","IEEE Conferences"
"Prediction of traffic density from wireless cellular data","S. A. Wadoo; A. H. Syed; V. Sood; S. Ali","New York Institute of Technology, 11568, USA; NA; NA; NA","2016 IEEE 19th International Conference on Intelligent Transportation Systems (ITSC)","","2016","","","575","580","This paper presents a method of estimating traffic density on a highway/freeway from cellular network data. The speed of the traffic is calculated/ measured from the cellular network communication between the vehicles and the network. The model for estimating the density from the speed is developed from the cellular data. The results are then validated through the one-equation partial differential equation dynamics for the traffic density.","2153-0017","978-1-5090-1889-5978-1-5090-1888-8978-1-5090-1890","10.1109/ITSC.2016.7795611","","https://ieeexplore.ieee.org/stamp/stamp.jsp?arnumber=7795611","Traffic Density;Wireless Cellular Networks;Model Identification;LWR model","Vehicles;Mathematical model;Data models;Road transportation;Traffic control;Vehicle dynamics;Analytical models","intelligent transportation systems;mobile communication;partial differential equations;road traffic control","traffic density;wireless cellular data;cellular network communication;one-equation partial differential equation dynamics","","1","","18","","","","","IEEE","IEEE Conferences"
"Can Social Media data augment travel demand survey data?","E. Chaniotakis; C. Antoniou; J. M. S. Grau; L. Dimitriou","Centre for Research and Technology Hellas - Hellenic Institute of Transport, Thessaloniki, Greece; Technical University of Munich, Germany; Centre for Research and Technology Hellas - Hellenic Institute of Transport, Thessaloniki, Greece; University of Cyprus, Nicosia, Cyprus","2016 IEEE 19th International Conference on Intelligent Transportation Systems (ITSC)","","2016","","","1642","1647","Travel surveys provide valuable inputs to a variety of models. While they are well-established, and reliable, they are also associated with large expenses (both in terms of time and actual cost). With the emergence of social media and alternative data sources, researchers and practitioners often wonder if such data sources can supplement (or obviate the need for) conventional data collection efforts. In this research, we empirically examine of the use of different social media data for such applications. Data from three popular Social Media is examined and compared with data from conventional travel-diary surveys for the city of Thessaloniki, Greece. Both spatial and temporal aspects of the activities' representation are considered. The findings of this research contribute towards the identification of methodologies that can support the inference of meaningful travel information from Social Media, which could in turn improve ITS applications.","2153-0017","978-1-5090-1889-5978-1-5090-1888-8978-1-5090-1890","10.1109/ITSC.2016.7795778","","https://ieeexplore.ieee.org/stamp/stamp.jsp?arnumber=7795778","","Facebook;Twitter;Urban areas;Transportation;Correlation;Electronic mail","data mining;intelligent transportation systems;social networking (online)","ITS application;travel information;Greece;Thessaloniki;travel-diary survey;data collection;alternative data sources;travel demand survey data;social media data","","1","","18","","","","","IEEE","IEEE Conferences"
"Modeling of decision-making behavior for discretionary lane-changing execution","Jianqiang Nie; Jian Zhang; X. Wan; Wanting Ding; Bin Ran","Jiangsu Key Laboratory of Urban ITS, School of Transportation, Southeast University, Jiangsu Province Collaborative Innovation Center of Modern Urban Traffic Technologies and Jiangsu Province Collaborative Innovation Center for Technology and Application of Internet of Things, Nanjing, 210096, China; Jiangsu Key Laboratory of Urban ITS, Jiangsu Province Collaborative Innovation Center of Modern Urban Traffic Technologies, School of Transportation, Southeast University and Research Centre for Internet of Mobility, Southeast University, Nanjing, 210096, China; Department of Civil &amp; Environment Engineering, University of Wisconsin-Madison, 53706 USA; Jiangsu Key Laboratory of Urban ITS, Jiangsu Province Collaborative Innovation Center of Modern Urban Traffic Technologies, School of Transportation, Southeast University and Research Centre for Internet of Mobility, Southeast University, Nanjing, 210096, China; Jiangsu Key Laboratory of Urban ITS, School of Transportation, Southeast University, Jiangsu Province Collaborative Innovation Center of Modern Urban Traffic Technologies and Jiangsu Province Collaborative Innovation Center for Technology and Application of Internet of Things, Nanjing, 210096, China","2016 IEEE 19th International Conference on Intelligent Transportation Systems (ITSC)","","2016","","","707","712","Modeling of decision-making behavior for discretionary lane-changing execution (DLCE) is fundamental to both movement simulation and controlling design of automatic vehicles. The existing gap acceptance models ingored the nonlinearity of drivers' DLCE decision-making behavior. Therefore, this study tries to analyze and simulate the DLCE decision-making behavior using the real trajectory data. First, a threshold of the lane-changer's lateral velocity is introduced to identify the starting point of DLCE process based on vehicle trajectories from the NGSIM data set. In the following, the empirical analysis based on traffic state variables at the instant of accepting DLCE event are presented, which prove the necessity of modeling DLCE decision-making behavior with machine learning method. Then, we propose a DLCE decision-making model using the Support Vector Machine (SVM). For verifying the prediction performance, the proposed model is compared with the Nagel's model based on the NGSIM data set. The comparison results indicate that the proposed model using SVM outperforms the Nagel's model in predicting the DLCE decision.","2153-0017","978-1-5090-1889-5978-1-5090-1888-8978-1-5090-1890","10.1109/ITSC.2016.7795631","","https://ieeexplore.ieee.org/stamp/stamp.jsp?arnumber=7795631","","Vehicles;Decision making;Trajectory;Technological innovation;Collaboration;Support vector machines;Predictive models","decision making;driver information systems;support vector machines","driver decision-making behavior modelling;discretionary lane-changing execution;DLCE;automatic vehicle movement simulation;automatic vehicle controlling design;lane-changer lateral velocity;empirical analysis;traffic state variable;support vector machine;SVM","","","","20","","","","","IEEE","IEEE Conferences"
"Pedestrian protection using the integration of V2V and the Pedestrian Automatic Emergency Braking System","B. Tang; S. Chien; Z. Huang; Y. Chen","Indiana University-Purdue University Indianapolis. 723 W. Michigan St., 46202, USA; Indiana University-Purdue University Indianapolis. 723 W. Michigan St., 46202, USA; Indiana University-Purdue University Indianapolis. 723 W. Michigan St., 46202, USA; Indiana University-Purdue University Indianapolis. 723 W. Michigan St., 46202, USA","2016 IEEE 19th International Conference on Intelligent Transportation Systems (ITSC)","","2016","","","2213","2218","Vehicle to Vehicle (V2V) communication systems enable vehicles to communicate with each other and use the shared information to make safety related decisions. However, the safety improvement of the current V2V systems only benefits V2V-enabled objects in the V2V network. The Pedestrian Automatic Emergency Braking System (PAEB) can utilize onboard sensors to detect pedestrians and make safety related actions so it benefits the individual vehicle and the pedestrians detected by its PAEB. To further improve pedestrian safety, the idea for integrating the capabilities of V2V and PAEB (V2V-PAEB) has been proposed, which allows the information of pedestrians detected by onboard sensors of a vehicle to be shared in the V2V network. A V2V-PAEB enabled vehicle uses not only its onboard sensors, but also received V2V messages from others to detect potential collisions with pedestrians and make better safety related decisions. In this paper, a Matlab/Simulink based simulation model of V2V-PAEB system is presented for demonstrating the proper architecture and information processing processes, and for providing the quick start of developing a better simulation model of V2V-PAEB. The proposed model has also been tested in PreScan simulation environment.","2153-0017","978-1-5090-1889-5978-1-5090-1888-8978-1-5090-1890","10.1109/ITSC.2016.7795913","","https://ieeexplore.ieee.org/stamp/stamp.jsp?arnumber=7795913","Intelligent vehicles;radar detection;real-time systems;vehicle detection;vehicle safety","Vehicles;Sensors;Mathematical model;Safety;Data models;Vehicular ad hoc networks;Computer architecture","braking;pedestrians;road safety;sensors;telecommunication computing;vehicular ad hoc networks","pedestrian protection;pedestrian automatic emergency braking system;V2V communication system;vehicle to vehicle communication system;safety improvement;pedestrian detection;onboard sensor;collision detection;Matlab-Simulink based simulation model;V2V-PAEB system;information processing;PreScan simulation environment","","2","","12","","","","","IEEE","IEEE Conferences"
"Robust environment perception for the Audi Autonomous Driving Cup","F. Kuhnt; M. Pfeiffer; P. Zimmer; D. Zimmerer; J. Gomer; V. Kaiser; R. Kohlhaas; J. M. Zöllner","FZI Research Center for Information Technology, Haid-und-Neu-Str. 10-14, 76131 Karlsruhe, Germany; FZI Research Center for Information Technology, Haid-und-Neu-Str. 10-14, 76131 Karlsruhe, Germany; FZI Research Center for Information Technology, Haid-und-Neu-Str. 10-14, 76131 Karlsruhe, Germany; FZI Research Center for Information Technology, Haid-und-Neu-Str. 10-14, 76131 Karlsruhe, Germany; FZI Research Center for Information Technology, Haid-und-Neu-Str. 10-14, 76131 Karlsruhe, Germany; FZI Research Center for Information Technology, Haid-und-Neu-Str. 10-14, 76131 Karlsruhe, Germany; FZI Research Center for Information Technology, Haid-und-Neu-Str. 10-14, 76131 Karlsruhe, Germany; FZI Research Center for Information Technology, Haid-und-Neu-Str. 10-14, 76131 Karlsruhe, Germany","2016 IEEE 19th International Conference on Intelligent Transportation Systems (ITSC)","","2016","","","1424","1431","One of the biggest challenges towards fully automated driving is achieving robustness. Autonomous vehicles will have to fully recognize their environment even in harsh weather conditions. Additionally, they have to be able to detect sensor and algorithm failures and react properly to keep the vehicle in a safe state.","2153-0017","978-1-5090-1889-5978-1-5090-1888-8978-1-5090-1890","10.1109/ITSC.2016.7795744","","https://ieeexplore.ieee.org/stamp/stamp.jsp?arnumber=7795744","","Roads;Automobiles;Robustness;Layout;Probabilistic logic;System performance","intelligent transportation systems;mobile robots;road vehicles","robust environment perception;Audi Autonomous Driving Cup;fully automated driving;compositional hierarchical models;temporal fusion;grid-based approximation;voting system;driving function degradation;driving function activation","","4","","13","","","","","IEEE","IEEE Conferences"
