"High-resolution LIDAR-based depth mapping using bilateral filter","C. Premebida; L. Garrote; A. Asvadi; A. P. Ribeiro; U. Nunes","Institute of Systems and Robotics, Dept. of Electrical and Computer Engineering, University of Coimbra, Portugal; Institute of Systems and Robotics, Dept. of Electrical and Computer Engineering, University of Coimbra, Portugal; Institute of Systems and Robotics, Dept. of Electrical and Computer Engineering, University of Coimbra, Portugal; Institute of Systems and Robotics, Dept. of Electrical and Computer Engineering, University of Coimbra, Portugal; Institute of Systems and Robotics, Dept. of Electrical and Computer Engineering, University of Coimbra, Portugal","2016 IEEE 19th International Conference on Intelligent Transportation Systems (ITSC)","","2016","","","2469","2474","High resolution depth-maps, obtained by upsampling sparse range data from a 3D-LIDAR, find applications in many fields ranging from sensory perception to semantic segmentation and object detection. Upsampling is often based on combining data from a monocular camera to compensate the low-resolution of a LIDAR. This paper, on the other hand, introduces a novel framework to obtain dense depth-map solely from a single LIDAR point cloud; which is a research direction that has been barely explored. The formulation behind the proposed depth-mapping process relies on local spatial interpolation, using sliding-window (mask) technique, and on the Bilateral Filter (BF) where the variable of interest, the distance from the sensor, is considered in the interpolation problem. In particular, the BF is conveniently modified to perform depth-map upsampling such that the edges (foreground-background discontinuities) are better preserved by means of a proposed method which influences the range-based weighting term. Other methods for spatial upsampling are discussed, evaluated and compared in terms of different error measures. This paper also researches the role of the mask's size in the performance of the implemented methods. Quantitative and qualitative results from experiments on the KITTI Database, using LIDAR point clouds only, show very satisfactory performance of the approach introduced in this work.","2153-0017","978-1-5090-1889-5978-1-5090-1888-8978-1-5090-1890","10.1109/ITSC.2016.7795953","","https://ieeexplore.ieee.org/stamp/stamp.jsp?arnumber=7795953","","Laser radar;Interpolation;Cameras;Three-dimensional displays;Vehicles;Spatial resolution;Estimation","","","","9","","17","","","","","IEEE","IEEE Conferences"
"Occupancy grid based urban localization using weighted point cloud","Lindong Guo; Ming Yang; Bing Wang; Chunxiang Wang","Key Laboratory of System Control and Information Processing, Ministry of Education, Department of Automation, Shanghai Jiao Tong University, 200240, China; Key Laboratory of System Control and Information Processing, Ministry of Education, Department of Automation, Shanghai Jiao Tong University, 200240, China; Key Laboratory of System Control and Information Processing, Ministry of Education, Department of Automation, Shanghai Jiao Tong University, 200240, China; Robotics Institute, School of Mechanical Engineering, Shanghai Jiao Tong University, 200240, China","2016 IEEE 19th International Conference on Intelligent Transportation Systems (ITSC)","","2016","","","60","65","Localization is considered as a key capability for autonomous vehicles act in urban environments. Though have been proved to be able to perform convictive results, localization methods using neither laser scanners nor vision sensors could achieve the goal about balancing between accuracy and cost. In this paper, an occupancy grid based localization framework is presented in order to obtain a precise positioning result with relatively low-cost sensor configuration in large scale urban environment. The proposed approach takes a prebuilt global grid map as prior knowledge for localization. Model based feature extraction method is introduced to provide laser points classification, with each extracted point allocated a specified weight to describe local characteristic. The prior grid map is generated from weighted point cloud to be able to describe the local metric features such as curbs and building facades. Localization function is then carried out with a weight point based maximum likelihood matching method to determine the correspondence between local point cloud and the reference grid map. There are also position initialization and reference map management modules to make the framework more practical and reliable. In the end, the proposed approach has been validated by promising experimental results with long distance tests in large urban environments.","2153-0017","978-1-5090-1889-5978-1-5090-1888-8978-1-5090-1890","10.1109/ITSC.2016.7795532","","https://ieeexplore.ieee.org/stamp/stamp.jsp?arnumber=7795532","","Three-dimensional displays;Feature extraction;Sensors;Laser modes;Roads;Vehicles","distance measurement;Global Positioning System;mobile robots;optical scanners;road vehicles;sensor fusion","occupancy grid;urban localization;weighted point cloud;autonomous vehicle;precise position;global grid map;position initialization;reference map management","","","","14","","","","","IEEE","IEEE Conferences"
"Heuristic optimizations for high-speed low-latency online map matching with probabilistic sequence models","G. R. Jagadeesh; T. Srikanthan","School of Computer Science and Engineering, Nanyang Technological University, Singapore 639798; School of Computer Science and Engineering, Nanyang Technological University, Singapore 639798","2016 IEEE 19th International Conference on Intelligent Transportation Systems (ITSC)","","2016","","","2565","2570","The computation speed and output latency of map matching are important considerations when processing location data, especially smartphone-generated noisy and sparse data, from a large number of users for real-time transportation applications. In this paper, we examine the factors affecting the efficiency of online map matching algorithms that are based on probabilistic sequence models such as Hidden Markov Models (HMM) and present several heuristic optimizations to improve their speed and latency. As shortest path computations account for most of the running time of probabilistic map matching algorithms, we propose a method for reducing the total number of such computations by pruning unlikely states in the probabilistic sequence model. Furthermore, we speed up the one-to-many shortest path computations by limiting the search space to an elliptical area that encompasses all the targeted destinations. We present a technique for reducing the latency of the Viterbi algorithm used to find the most likely state sequence in a HMM or a similar model. This technique enables the early output of partial state sequences based on an estimate of the probability of a state being part of the eventual most likely sequence. Experiments using real-world location data show that the heuristic optimizations significantly reduce the running time and output latency with negligible loss of accuracy.","2153-0017","978-1-5090-1889-5978-1-5090-1888-8978-1-5090-1890","10.1109/ITSC.2016.7795968","","https://ieeexplore.ieee.org/stamp/stamp.jsp?arnumber=7795968","","Hidden Markov models;Roads;Viterbi algorithm;Optimization;Computational modeling;Vehicles;Probabilistic logic","hidden Markov models;maximum likelihood estimation;probability;sequences;transportation","heuristic optimization;high-speed low-latency online map matching;location data processing;smartphone;real-time transportation application;hidden Markov model;HMM;shortest path computation;probabilistic sequence model;Viterbi algorithm","","1","","14","","","","","IEEE","IEEE Conferences"
"Lane-level map-matching based on optimization","J. Rabe; M. Meinke; M. Necker; C. Stiller","Daimler AG, Research &amp; Development, Sindelfingen, Germany; Daimler AG, Research &amp; Development, Sindelfingen, Germany; Daimler AG, Research &amp; Development, Sindelfingen, Germany; Institute of Measurement and Control Systems, Karlsruhe Institute of Technology, Germany","2016 IEEE 19th International Conference on Intelligent Transportation Systems (ITSC)","","2016","","","1155","1160","We propose a method for ego-lane estimation that can robustly determine the currently used lane as required by future lane-precise navigation systems. It employs a lane-level map-matching on a digital road map through least-squares optimization and only requires sensors available in current production vehicles, such as GPS, odometry, visual lane-marking detection and radars. Radar data is used in a RANSAC-based filtering step for lane hypotheses and, together with camera data, in the determination of the reliability of each lane hypothesis. Detailed evaluation in actual traffic in urban scenarios shows very low error rates below 0.2%.","2153-0017","978-1-5090-1889-5978-1-5090-1888-8978-1-5090-1890","10.1109/ITSC.2016.7795702","","https://ieeexplore.ieee.org/stamp/stamp.jsp?arnumber=7795702","","Trajectory;Vehicles;Sensors;Global Positioning System;Optimization;Roads;Radar","estimation theory;filtering theory;Global Positioning System;least squares approximations;optimisation;reliability;sensors","reliability;camera;RANSAC-based filtering step;radar;visual lane-marking detection;odometry;GPS;sensor;least square optimization;digital road map;lane-precise navigation system;ego-lane estimation;lane-level map-matching","","6","","12","","","","","IEEE","IEEE Conferences"
"Surround vehicles trajectory analysis with recurrent neural networks","A. Khosroshahi; E. Ohn-Bar; M. M. Trivedi","Laboratory for Intelligent and Safe Automobiles (LISA), University of California, San Diego, USA; Laboratory for Intelligent and Safe Automobiles (LISA), University of California, San Diego, USA; Laboratory for Intelligent and Safe Automobiles (LISA), University of California, San Diego, USA","2016 IEEE 19th International Conference on Intelligent Transportation Systems (ITSC)","","2016","","","2267","2272","Behavior analysis of vehicles surrounding the egovehicle is an essential component in safe and pleasant autonomous driving. This study develops a framework for activity classification of observed on-road vehicles using 3D trajectory cues and a Long Short Term Memory (LSTM) model. As a case study, we aim to classify maneuvers of surrounding vehicles at four way intersections. LIDAR, GPS, and IMU measurements are used to extract ego-motion compensated surround trajectories from data clips in the KITTI benchmark. The impact of different prediction label space choices, feature space input, noisy/missing trajectory data, and LSTM model architectures are analyzed, presenting the strengths and limitations of the proposed approach.","2153-0017","978-1-5090-1889-5978-1-5090-1888-8978-1-5090-1890","10.1109/ITSC.2016.7795922","","https://ieeexplore.ieee.org/stamp/stamp.jsp?arnumber=7795922","","Vehicles;Trajectory;Logic gates;Turning;Hidden Markov models;Three-dimensional displays;Feature extraction","neural nets;road safety;road vehicles;traffic engineering computing","ego-motion extraction;IMU measurement;GPS measurement;LIDAR measurement;maneuver classification;long short term memory model;3D trajectory cues;activity classification;autonomous driving;egovehicle;behavior analysis;recurrent neural networks;surround vehicles trajectory analysis","","15","","22","","","","","IEEE","IEEE Conferences"
"Driver hand localization and grasp analysis: A vision-based real-time approach","Siddharth; A. Rangesh; E. Ohn-Bar; M. M. Trivedi","Department of Electrical and Computer Engineering at University of California, San Diego, La Jolla, 92093 USA; Laboratory for Intelligent and Safe Automobiles (LISA), University of California San Diego, La Jolla, 92093-0434 USA; Laboratory for Intelligent and Safe Automobiles (LISA), University of California San Diego, La Jolla, 92093-0434 USA; Laboratory for Intelligent and Safe Automobiles (LISA), University of California San Diego, La Jolla, 92093-0434 USA","2016 IEEE 19th International Conference on Intelligent Transportation Systems (ITSC)","","2016","","","2545","2550","Extracting hand regions and their grasp information from images robustly in real-time is critical for occupants' safety and in-vehicular infotainment applications. It must however, be noted that naturalistic driving scenes suffer from rapidly changing illumination and occlusion. This is aggravated by the fact that hands are highly deformable objects, and change in appearance frequently. This work addresses the task of accurately localizing driver hands and classifying the grasp state of each hand. We use a fast ConvNet to first detect likely hand regions. Next, a pixel-based skin classifier that takes into account the global illumination changes is used to refine the hand detections and remove false positives. This step generates a pixel-level mask for each hand. Finally, we study each such masked regions and detect if the driver is grasping the wheel, or in some cases a mobile phone. Through evaluation we demonstrate that our method can outperform state-of-the-art pixel based hand detectors, while running faster (at 35 fps) than other deep ConvNet based frameworks even for grasp analysis. Hand mask cues are shown to be crucial when analyzing a set of driver hand gestures (wheel/mobile phone grasp and no-grasp) in naturalistic driving settings. The proposed detection and localization pipeline hence can act as a general framework for real-time hand detection and gesture classification.","2153-0017","978-1-5090-1889-5978-1-5090-1888-8978-1-5090-1890","10.1109/ITSC.2016.7795965","","https://ieeexplore.ieee.org/stamp/stamp.jsp?arnumber=7795965","In-cabin activity analysis;hand-object interaction;driver cell-phone usage;human-vehicle interaction;highly automated vehicles;control transition;takeover readiness","Feature extraction;Skin;Lighting;Vehicles;Detectors;Image color analysis;Wheels","image classification;image sensors;palmprint recognition","driver hand localization;grasp analysis;vision-based real-time approach;in-vehicular infotainment application;occupant safety;fast ConvNet framework;pixel-based skin classifier;global illumination;pixel-level mask;pixel based hand region detection;naturalistic driving setting;pipeline;gesture classification;mobile phone","","","","42","","","","","IEEE","IEEE Conferences"
"Flexible car-following models incorporating information from adjacent lanes","V. Papathanasopoulou; C. Antoniou","School of Rural and Surveying Engineering, National Technical University of Athens, Greece; Full Professor in the Chair of Transportation Systems Engineering at the Technical University of Munich, Germany","2016 IEEE 19th International Conference on Intelligent Transportation Systems (ITSC)","","2016","","","701","706","In recent years, technological advances have significantly improved Driver Assistance Systems and there has been an increasing interest in autonomous vehicles. Aiming at safety, reliability and convenience, autonomous vehicles require detailed car-following models that could model driving behavior in an efficient way. In this research, an existing flexible car-following model is enriched by incorporating additional information about density of two adjacent lanes. This research aims to explore if the additional information on density of adjacent lanes could improve the accuracy of the car-following model. More realistic detailed models could provide a robust solution to autonomous driving. The updated model is applied to reconstructed NGSIM data using a flexible regression technique, loess method. For a more in depth analysis, a meta-model is developed to evaluate the magnitude of the effect of the considered predictor variables on the proposed model. Finally, conclusions are drawn and future prospects are suggested.","2153-0017","978-1-5090-1889-5978-1-5090-1888-8978-1-5090-1890","10.1109/ITSC.2016.7795630","","https://ieeexplore.ieee.org/stamp/stamp.jsp?arnumber=7795630","","Data models;Predictive models;Mathematical model;Autonomous vehicles;Automobiles","mobile robots;regression analysis;road safety;road vehicles","flexible car-following models;driver assistance systems;autonomous vehicles;road safety;adjacent lane density;autonomous driving;NGSIM data;regression technique;loess method","","1","","27","","","","","IEEE","IEEE Conferences"
"Agent-based model of highway traffic: Reduction in driving efficiency with density","P. Kasture; H. Nishimura","Graduate School of System Design and Management, Keio University, Yokohama, Japan; Graduate School of System Design and Management, Keio University, Yokohama, Japan","2016 IEEE 19th International Conference on Intelligent Transportation Systems (ITSC)","","2016","","","29","34","In this paper, we present an analysis of the correlation between the driving efficiency of drivers and traffic congestions on a highway. An agent-based model of highway traffic is used, where individual drivers are represented by agents undergoing single-lane unidirectional motion on a highway. In the proposed model, changes in the agent-modelling rules are able to simulate behavioural changes in driving efficiency of drivers. In addition, results from multiple simulations are compared with real life data. These comparisons show that during traffic congestions, driving efficiency of amateur drivers on a highway declines with an increase in the vehicular density on the same highway. Furthermore, this decrease in the driving efficiency of amateur drivers leads to a reduction of average velocity of all drivers on the same highway.","2153-0017","978-1-5090-1889-5978-1-5090-1888-8978-1-5090-1890","10.1109/ITSC.2016.7795527","","https://ieeexplore.ieee.org/stamp/stamp.jsp?arnumber=7795527","","Vehicles;Road transportation;Mathematical model;Jamming;Simulation;Analytical models;Data models","road traffic;traffic engineering computing","agent-based model;highway traffic congestion;single-lane unidirectional motion","","","","10","","","","","IEEE","IEEE Conferences"
"Path tracking Model Predictive Control of a Tilt-rotor UAV carrying a suspended load","M. A. Santos; G. V. Raffo","Graduate Program in Electrical Engineering, Federal University of Minas Gerais, 31270-901, Belo Horizonte, Brazil; Graduate Program in Electrical Engineering, Federal University of Minas Gerais, 31270-901, Belo Horizonte, Brazil","2016 IEEE 19th International Conference on Intelligent Transportation Systems (ITSC)","","2016","","","1458","1463","This paper proposes a constrained Model Predictive Controller (MPC) to solve the path tracking problem of a Tilt-rotor UAV carrying a suspended load. Initially, a nonlinear model for the multi-body system is obtained via Euler-Lagrange formulation. Then, to design the constrained linear MPC, the equations of motion of the Tilt-rotor UAV with suspended load are linearized around the reference trajectory. Furthermore, to achieve null steady state error throughout the trajectory in presence of constant external disturbances and parametric uncertainties, the state vector is augmented with the integral action of some selected states. In addition, since the system is underactuated, the prediction model is also formulated in the incremental form to cope with disturbances affecting the system. Simulation results are carried out to corroborate the good performance of the proposed MPC when performing path tracking of the UAV with reduced load's swing.","2153-0017","978-1-5090-1889-5978-1-5090-1888-8978-1-5090-1890","10.1109/ITSC.2016.7795749","","https://ieeexplore.ieee.org/stamp/stamp.jsp?arnumber=7795749","","Load modeling;Mathematical model;Predictive models;Trajectory;Transportation;Uncertainty;Rotors","autonomous aerial vehicles;linearisation techniques;nonlinear control systems;position control;prediction theory;predictive control;rotors (mechanical)","path tracking model predictive control;tilt-rotor UAV;suspended load linearization;nonlinear model;multibody system;Euler-Lagrange formulation;constrained linear MPC;null steady state error;state vector augmentation","","","","19","","","","","IEEE","IEEE Conferences"
"Consensus with state obfuscation: an application to speed advisory systems","W. Griggs; G. Russo; R. Shorten","University College Dublin, School of Electrical, Electronic and Communications Engineering, Belfield, 4, Ireland; IBM Research Ireland, Optimisation and Control Group, Dublin, Ireland; University College Dublin, School of Electrical, Electronic and Communications Engineering, Belfield, 4, Ireland","2016 IEEE 19th International Conference on Intelligent Transportation Systems (ITSC)","","2016","","","2506","2511","In this paper, we present a new speed advisory system (SAS). The system provides indications to drivers which, if followed, guide the network of vehicles towards a common speed. The SAS we present is distributed and one of its key features is that the vehicles are guided towards the common speed by receiving obfuscated information. Essentially, this means that the desired network behaviour is achieved and, at the same time, there is no vehicle in the network that obtains clear knowledge of the state of any other vehicle. This results in a privacy-preserving feature which is particularly useful in smart cities applications, where drivers might not be willing to share their transient state with others.","2153-0017","978-1-5090-1889-5978-1-5090-1888-8978-1-5090-1890","10.1109/ITSC.2016.7795959","","https://ieeexplore.ieee.org/stamp/stamp.jsp?arnumber=7795959","","Vehicles;Base stations;Roads;Algorithm design and analysis;Acceleration;White noise;Convergence","data privacy;smart cities;traffic information systems","state obfuscation;speed advisory systems;SAS;obfuscated information;network behaviour;privacy-preserving feature;smart cities applications;transient state","","6","","21","","","","","IEEE","IEEE Conferences"
"Optimization based design of heterogeneous truck fleet and electric propulsion","T. Ghandriz; J. Hellgren; M. Islam; L. Laine; B. Jacobson","Division of Vehicle Engineering and Autonomous Systems, Applied Mechanics, Chalmers University of Technology, SE-41296 Gteborg, Sweden; Volvo Group Trucks Technology, SE-405 08 Gteborg, Sweden; Division of Vehicle Engineering and Autonomous Systems, Applied Mechanics, Chalmers University of Technology, SE-41296 Gteborg, Sweden; Volvo Group Trucks Technology, SE-405 08 Gteborg, Sweden; Division of Vehicle Engineering and Autonomous Systems, Applied Mechanics, Chalmers University of Technology, SE-41296 Gteborg, Sweden","2016 IEEE 19th International Conference on Intelligent Transportation Systems (ITSC)","","2016","","","328","335","Many researches have been focused on vehicle routing problem during past decades where subject vehicles are previously fully designed and ready to start operation. Further, extensive studies have been done on powertrain design irrespective of the routes where the vehicle is going to be employed. In the present paper, we try to define a new branch of problems where the vehicle design, in particular its propulsion system and loading capacity, is treated simultaneously with the routing problem. The focus is on optimization based design of heterogeneous electric truck fleet to perform a prescribed task with a lowest cost on an available set of routes. The approach is illustrated in a simple case study problem. It is shown that long heavy combination vehicles are energy-efficient but not cost-optimal on short routes.","2153-0017","978-1-5090-1889-5978-1-5090-1888-8978-1-5090-1890","10.1109/ITSC.2016.7795575","","https://ieeexplore.ieee.org/stamp/stamp.jsp?arnumber=7795575","","Vehicles;Batteries;Optimization;Electric motors;Propulsion;Vehicle dynamics;Vehicle routing","electric propulsion;electric vehicles;off-road vehicles;power transmission (mechanical)","energy-efficient long heavy combination vehicles;heterogeneous electric truck fleet;loading capacity;powertrain design;vehicle routing problem;optimization-based design;electric propulsion system","","2","","15","","","","","IEEE","IEEE Conferences"
